,words,cluster
0,bayar bpjs sanggup percaya uang gaib triliun pulih ekonomi rang pandemi covid,0
1,didik gratis sehat gratis bpjs iur nunggak listrik subsidi,0
2,iya wajib bayar layan sehat bpjs sehat usaha wajib aneh,0
3,layan sehat bpjs,7
4,beda iur bpjs sehat naek,0
5,bpjs salah kelola direksi tahan,0
6,kalimat kau bilang merdeka bukti nama merdeka rakyat bpjs sehat iur,0
7,sulit rujuk rumah sakit sesuai arah dokter faskes tingkat ajar bpjs,0
8,heran bpjs bayar tenaga sehat,0
9,jamin paksa asuransi sehat tambah paksa bpjs,6
10,miris sehat jadi bisnis rakyat palak penting kapitalis,0
11,jamsostek ketenagakerjaan bpjs sehat adalagi bp tapera dapat bayar iur mulu,0
12,jokowi beban rakyat miskin covid turun bbm naik bpjs sehat cebong sakit biaya,0
13,bpjs telat bayar apd bayar nama doang tri sehat dalem sakit,0
14,anak udh santai kis suami perlu lahir anak ngurus ribet,0
15,kurir salah usaha logistik bumn kasihan masyarakat bayar iur,0
16,tanggung bpjs sehat berat,0
17,ngurus gatau serta bpjs sehat wajib autodebit ngelampirin atm buku rekening susah,0
18,sehat jamin penuh negara rakyat bayar premi bpjs layan sehat,0
19,drama bpjs sehat ngga selesai selesai,0
20,bpjs sehat iur turun,0
21,obat pake rujuk sakit faskes 1,0
22,sumpal kapital gitu tanggung jawab negara sehat rakyat jurus palak ala bpjs naik gitu jaga satu,0
23,hasil segitu usaha beban rakyat ketulungan pandemi iur naik,0
24,cek iur bpjs sehat apk mei bayar april gilir bayar,6
25,tolak lupa delapan mantan menteri sehat siti fadilah supari bahaya bpjs vaksin,0
26,negara biaya makan napi lepas jamin sehat iur bpjs naik,0
27,desa kota puskesmas klinik fasilitas sehat mumpuni rsud,6
28,nyuruh adek kuliah sehat bayang kerja hidup sejahtera denger cerita temen profesi sehat susah,0
29,kalau balik gimana rakyat lelah biaya negara pph ppn pbb lstrik mahal,0
30,taik bpjs kelas lapang alas rs ngasih kelas ujung ujung masuk kelas titid,0
31,gausa tinggi lu bahas bbm bpjs pln bahas layan bpjs ngaco,0
32,rakyat biaya negara bayar pajak iur bpjs harga harga negara biaya rakyat,0
33,bayar iur darimana jiwasraya asabri ngutang pertamina bpjs listrik,0
34,naikin bpjs mending jokowi bubarin bpip ksp stafsus presiden amp wapres guna hemat triliun,0
35,biaya perintah makan nyari bayar pajak bayar bpjs,0
36,kasi negara ngemis rakyat melangar psbb dapetnya cuman m boro boro biaya rakyat,0
37,rakyat rakyat hidup biaya perintah naikin bpjs listrik,0
38,negara biaya rakyat bbm turun turun bpjs sehat gratis dinaikin,0
39,bbm turun dunia turun rakyat biaya perintah naik iur bpjs,0
40,wifi bpjs rumah bayar iur bpjs,0
41,waras bpjs gitu sehat tapera gitu properti didik pangan nih duit perintah,1
42,sda limpah selenggara sehat gratis alih alih gratis rakyat rasa naik iur,0
43,perintah menomorsatukan sehat lantas bijak naik bpjs sehat kena,0
44,gaji potong bpjs sehat pilih manfaat,6
45,ngomong utama sehat lapang iur bpjs naik obat mahal beli,6
46,rumah ngapain gaji potong tapera potong pph ps bpjs ketenagakerjaan bpjs sehat,0
47,bpjs sehat jalan penuh carut marut muncul tapera juntrung wajib,0
48,biar sadar nuntut layan bpjs nomor dua lupa bayar kaga sehat,0
49,potong gaji kerja tambah bpjs sehat bp jamsostek iur tabung berat,0
50,maksud gimana pajak kantor paksa pakai bpjs motong uang rasa manfaat,0
51,rakyat susah potong pph bpjs tk sehat pensiun tega sih bikin potong,1
52,sih dah potong bpjs ketenagakerjaan sehat,0
53,calo legislatif manajemen bpjs sehat baik,1
54,bpjs sehat make sense sehat butuh manusia terus iur berat,0
55,kasih opini bpjs tau morat marit rada arah bangkrut rumah sakit bayar,0
56,potong bpjs ketenagakerjaan bpjs sehat detail fungsi,0
57,persis kayak bpjs sehat asal askesnya pns inti sih bijak salah,0
58,bpjs sehat oke cover sakit pake bpjs tk oke pensiun bp tapera,1
59,ngomong utama sehat lapang iur bpjs naik obat mahal beli nama peras,0
60,rezim bijak pakai nurani rakyat susah keppres naik bpjs sehat,0
61,potong iur bpjs naker sehat pensiun gede berat,0
62,bpjs sehat bpjs ketenagakerjaan bpjs tk pensiun tapera abis nih habis gaji,6
63,potong ditambahin bonus coba potong gaji,0
64,bpjs tk sehat tapera mayan gaji potong,0
65,swasta gaji potong phk perintah naik tarif listrik naik tarif bpjs blt salah sasar,0
66,potong slip gaji bpjs ketenagakerjaan bpjs jamin pensiun bpjs sehat tapera,6
67,bpjs sehat jalan penuh carut marut muncul tapera wajib,6
68,beban pikul blt listrik diskon bbm turun prakerja bpjs iur,0
69,bpjs kita tau latar belakang terap bijak,0
70,bayang hakiki turun kadang potong pajak hasil potong bpjs sehat,6
71,bpjs sehat iya bpjs tk iya tambah iur gaji pas umr ancur,6
72,bikin pp tapera ajar bpjs sehat,1
73,udh potong pph bpjs tk jamin pensiun bpjs sehat utang kantor,0
74,laksana hukum pakde bpjs sehat tetep,1
75,hak rakyat tuk sehat peduli bpjs tetep cuman putus ptun,1
76,potong bpjs ketenagakerjaan sehat potong tapera peras kaya sapi perah,1
77,konsep bang indonesia pungut iur bpjs ketenagakerjaan bpjs sehat habis gaji,0
78,potong bpjs asuransi sehat tanggung perintah,0
79,kasihan hamil suruh jam siang periksa kandung rsud kembang jakarta barat pake bpjs,0
80,bpjs sehat bpjs tk pph tapera dasar sapi perah,0
81,presiden negara vonis lawan hukum karhutla naik tarif bpjs sehat,6
82,asuransi sehat maksud bpjs asuransi gantung asuransi,6
83,harap cabut pres naik iur bpjs sehat perintah thr pahit masyarakat,0
84,gin negara cari duit nutupin defisit saat pandemi orang hidup susah hilang hasil,0
85,bpjs sehat bayar ama usaha enak sih goblok,0
86,enam puluh persen serta mandiri bpjs sehat ancam bayar pasti ekonomi nyungsep,0
87,bayar negara pph bpjs sehat ketenagakerjaan muncul tapera,6
88,potong bpjs tenaga kerja potong bpjs sehat potong dana pensiun kerja sungguh berat,0
89,kerja buruh alami potong iur bpjs sehat bpjs tenaga kerja susah,0
90,boneka rampok rakyat,0
91,bpjs sehat sanksi tabung tapera sanksi gilir nyata lawan hukum hakim adil nyengir doang,0
92,punten potong bpjs ketenagakerjaan sehat nambah koma persen rumah,0
93,bener gaji mentok umr potong bpjs sehat tunjang tua potong,0
94,bpjs kessehatan tapera dicairin umur ujur tapera nikmatin rumah,0
95,nambah potong upah mah bpjs ketenagakerjaan bpjs pensiun bpjs sehat tapera,0
96,salah kelola direksi tahan,6
97,pajak paham negara butuh bangun pelihara itung zakat islam koma persen bpjs sehat tapera,0
98,awat pasien covid klaim perintah hasil pcr positif hasil pcr periksa pakai dana rugi mahal,0
99,masuk jamin tua gambar persentase ragu,0
100,gotong ria bpjs sehat sehat sakit pusat pemda negara masyarakat rakyat rugi,0
101,lelucon bpjs tk seringkali ambil bpjs sehat skrg ambil hak rakyat,0
102,potong wajib perintah indonesia rakyat bpjs sehat bpjs ketenagakerjaan pph tapera rugi,0
103,warga tahun pake asuransi sehat pake kpr btn aman lancar rumah pake bpjs tolak rumah sakit,0
104,perintah bikin program serah paksa rakyat wajib bpjs sehat ketenagakerjaan,0
105,pribadi nggak suka bijak tapera hitung hitung ngga gin hitung bikin orang ngga bayar premi bpjs sehat nggak tuju nggak disinformasi,0
106,ratus ribu bayar perlu bpjs sehat nombok bantuin masyarakat deh,0
107,pecat karyawan biar karyawan sejahtera dapet bpjs sehat itu iur berat,0
108,rumah duit pakai kelola bunga makan bpjs tenaga kerja bpjs sehat tapera rakyat objek derita,0
109,kasi lo cape cape bayar asuransi sehat bpjs lu sakit minimal celaka,0
110,sumbangsih pajak pabrik rokok ratus triliun dipake nalangin bpjs sumbangsih gede ngerusak sehat masyarakat hasil apa kelola duit,0
111,potong pajak potong bpjs sehat potong bpjs pensiun potong tapera habis gaji,0
112,dasar hitung tentu gaji upah tetap program jamin sosial maksimal belas juta kaya bpjs sehat pakai,0
113,gas bmm air beli negara perintah kelola harga bantu rakyat pandemi sehat kelola perintah ma kangkang rakyat korban tapera,0
114,tagih negara bulan pph bpjs sehat ketenagakerjaan muncul tapera utang meres rakyat kntl,0
115,paham bpjs wajib bayar kerja emang butuh sehat paham layan bpjs hancur,0
116,pph bpjs sehat bpjs tk tapera cicil kpr habis gaji,0
117,potong bpjs tenaga kerja bpjs sehat tapera,0
118,lelucon bpjs tk seringkali gabisa ambil bpjs sehat ambil hak rakyat,0
119,bpjs sehat ketenagakerjaan muncul tapera berat,0
120,potong wajib perintah indonesia rakyat bpjs sehat bpjs ketenagakerjaan pph tapera nilai berat masyarakat,0
121,gaji puluh juta gaji umk gimana standar umk kabupaten gunungkidul jogja koma tujuh juta potong bpjs sehat ketenagakerjaan potong tapera,0
122,indah hidup negeri wakanda hasil kerja peras keringat terima gaji sunat perintah iur bpjs sehat keluarga pakai jht pph besar puluh persen,0
123,potong bpjs tenaga kerja potong bpjs sehat potong dana pensiun kerja pph himpit tabung tapera dana haji embat,0
124,habis gaji pegawai bpjs sehat bpjs jht bpjs pensiun pajak rumah,0
125,harga minyak dunia turun turun harga bbm iur bpjs naik materi sehat susah rakyat temu,0
126,nambah potong gaji bpjs ketenagakerjaan bpjs sehat,0
127,anggap sektor pariwisata buka mohon bantu perintah karyawan usaha pariwisata contoh sederhana relaksasi bayar pajak daerah pb pln pdam bpjs sehat bpjs tk subsidi harga bahan pokok makan gaji,0
128,kasihan buruh potong pph puluh potong bpjs ketenagakerjaan potong bpjs sehat potong tapera sisa,0
129,bpjs kaga bener akal akal urusin perut ama sehat masyarakat biar kenyang rumah,0
130,bayar negara pph bpjs sehat ketenagakerjaan muncul tapera utang jalan meres jalan,0
131,kerja buruh alami potong iur bpjs sehat bpjs tenaga kerja pensiun tambah potong iur tapera miskin,0
132,punten potong persen bpjs ketenagakerjaan sehat nambah koma persen rumah tapera nabung beli rumah,0
133,bener udh gaji mentok umr potong bpjs sehat bpjs ketenagakerjaan tapera,0
134,produktif era new normal jamin layak hidup perintah jamin sehat bpjs jiwasraya stop orang lemah hakikat manusia lewat uji,0
135,de utang sih orang orang situasi gin mana karyawan rumah gaji potong sampe biar kena phk bpjs iur,0
136,subsidi ebt kali defisit bpjs sehat nikmat korporasi rugi daya masuk grid peak kepake pln bayar butuh backup energi fosil,0
137,bakar hutan bpjs sehat internet papua lapor bongkar,0
138,nama program tumpang tindih bpjs sehat bp jamsostek iur bulan tanggung usaha,0
139,langgan bpjs sehat pinjam,0
140,anjir lemes baca payday suka sedih potong pph bpjs sehat bpjs tk bpjs jht tapera berat,0
141,bayar manual september ganti autodebet indikator autodebet sebenernya salah orang patuh bayar bpjs sehat,0
142,baca pp khusus pns laku nasional nih thp bpjs sehat trus bpjs pensiun tapera berat terap nasional,0
143,lu bayangin potong pph persen bpjs sehat persen bpjs tk persen jht persen bom potong uda nyampe belas persen anjing,0
144,bp jamsostek bpjs sehat bp tapera tinggal nunggu bp bp negara kalah komplek rumah iur,0
145,perintah iur bpjs sehat kelas ratus delapn puluh enam ribu naik tarif segitu rakyat bayar bbm turun,0
146,nambah potong upah bpjs ketenagakerjaan bpjs pensiun bpjs sehat pp tapera bagi duit sisa gaji,0
147,masyarakat langkah perintah terap sistem tarif adil serta bpjs sehat,0
148,gin gin gaji potong bpjs sehat bpjs pensiun mati pph presiden potong persen potong potong,0
149,bpjs sehat gotong royong sama masyarakat perintah bantu sepenuh,0
150,ikhlas bayar bpjs sehat tapera ikhlas bpjs ketenagakerjaan tapera cari puluh delapan harga tanah rumah taun kejar setor banget perintah,0
151,dp nol persen urgensi masuk kaya iris bpjs sehat sm bpjs tk jamin tarik iur tarik pas pensiun stop kerja rumah urgent sehat selamat kerja pensiun,0
152,potong bpjs sehat ketenagakerjaan enak ko tambah tapera tapera asu,0
153,agustus ribu sembilan belas bilang perintah langgar hukum kait blokir internet karhutla iur bpjs sehat becus,0
154,jaga sehat pajak bpjs nyari duit susah,0
155,potong jht bpjs ketenagakerjaan bpjs sehat kah upah potong manfaaatnya tau lari mana cair jht belit naudzubillah uang loh ilang gitu cair kerja kemaren asu,0
156,potong gaji bulan bpjs sehat ketenagakerjaan pajak hasil jht potong tapera,0
157,lupa naik tarif bpjs sehat berat,0
158,bpjs sehat defisit ngurus bpjs ketenagakerjaan ribet ampun uang potong gaji,0
159,bagi porsi iur tapera unik turut company nol koma persen employee koma persen wajib kerja wajib usaha benefit karyawan ilustrasi benefit karyawan bpjs sehat berat karyawan,0
160,inget kerja layan sehat sumpah pilih kasih pasien atur kerja pasien bpjs vip dua pasien tetep pasien pasien bpjs samping,0
161,wei gila kali yak zakat ajar agama persen hasil ampe persem alesannya biar rumah gaji potong bpjs sehat tenagakerjaan pajak msh tambah potong,0
162,naik iur bpjs sehat pandemi,6
163,bpjs sehat bpjs ketenagakerjaan tapera wajib tapera si kerja rumah potong gaji potong berat,0
164,hasil kerja kerja mandiri potong program tapera tuju bantu masyarakat indonesia milik rumah sistem padu bpjs ketenagakerjaan bpjs sehat tarik ladang korupsi,0
165,potong puluh persen iur bpjs tk bpjs sehat pph asuransi swasta dana pensiun swasta bpjs sehat dipake,0
166,tapera bpjs tenaga kerja sehat persen dapat hasil persen hilang uap mana harap sembilan puluh sembilan persen serta peduli ambil hak,0
167,enam puluh persen serta mandiri stop bayar,1
168,bpjs sehat bpjs ketenagakerjaan bpjs tk pensiun tapera abis nih habis gaji ku,0
169,gaji potong simpan sehat ngurusnya ribet uang,0
170,perintah naik tarif listrik naik tarif bpjs blt salah sasar tolong hutang negara imf bayar hutang beban anak cucu moga sehat,0
171,beban pikul dpt blt listrik diskon bbm turun prakerja bpjs sehat turun harga beras gaji turun bantu mikul beban ayo,0
172,program nih dibikinin rumah gimana wajib kaya bpjs sehat bpjs jarang pake,0
173,bayang hakiki turun kadang potong pajak hasil potong bpjs sehat keluarga,0
174,bayar bpjs sehat iya bpjs tk iya tambah iur gaji pas umr ancur,0
175,konsep bang indonesia iur bpjs ketenagakerjaan bpjs sehat jht muncul hasil pensiun ambil bentuk deposit perban surat utang ribet,0
176,potong sih bpjs asuransi sehat,0
177,kasihan hamil suruh jam siang si dokter jam sore pasien bpjs sehat lambat periksa,0
178,bpjs sehat bpjs tnkr pph tapera dasar sapi perah,0
179,presiden negara vonis lawan hukum karhutla naik tarif bpjs sehat lanjut vonis lawan hukum madam internet papua papua barat negara negara hukum,0
180,iur iur tapera bpjs sehat berat banget,0
181,asuransi sehat maksud bpjs asuransi gantung asuransi claim tuju rapidnya screening gejala rujuk cover,0
182,bpjs sehat bayar ama usaha hebat lo goblok uu bpjs ama ubah goblok,0
183,bpjs sehat full bayar usaha lu kecuali bpjs tk subsidi usaha lu sisa potong dati gaji lu hitung hitung simpan lu kurang dasar tolol lu sakit obat full biaya pake bpjs,0
184,tapera tabung rumah rakyat arisan rumah kayak cuman akal akal nambah cashin persis bpjs bilang arisan sehat,0
185,bpjs sehat bpjs ketenagakerjaan kualitas kerja karyawan rewel pegat,0
186,kali perintah jokowi langgar hukum bakar lahan naik bpjs sehat shutdown internet,0
187,hardcore ujung ujung muncul uu minerba uu cilaka naik bpjs sehat naik bmm baru pitera jilat rezim mah atas baik rakyat,0
188,walah catut potong jancuk bikin bijak potong jkn bpjs sehat potong pajak,0
189,ayo cuy iur kerja bpjs sehat bpjs ketenagakerjaan tambah koperasi usaha hitung pph tambah tapera,0
190,bpjs sehat ketenagakerjaan real mutlak ngurusi rumah ngeh urgensi berat,0
191,potong slip gaji bpjs ketenagakerjaan bpjs jamin pensiun bpjs sehat tapera potong koperasi potong absen abis gaji,0
192,juang rakyat henti jerat bpjs sehat,0
193,bpjs sehat beban rakyat tolak ma dasar penghisap darah rakyat tobat nekat beban tapera karyawan kerja mandiri diktator wajah ganteng,0
194,tapera pungut bpjs tk bpjs sehat luar potong pph pajak ternak pajak anak pajak tanam biara negara kaya,0
195,rumah ngapain gaji potong tapera potong pph bpjs ketenagakerjaan bpjs sehat tapera cebong bahagia beli kopi gelas plastik ember,0
196,bpjs sehat jalan penuh carut marut muncul tapera wajib untuk orang rumah perintah main sedot uang rakyat,0
197,potong gaji kerja tambah bpjs sehat bp jamsostek iur tabung rumah rakyat tapera sarana kerja milik rumah tinggal sifat wajib kerja abis gaji,0
198,maksud gimana pajak kantor kantor paksa pakai bpjs motong uang pakai layan beda asuransi sehat swasta potong sejahtera ngga peres,0
199,potong iur bpjs naker sehat pensiun gede,6
200,pph ppn bpjs sehat bpjs ketenagakerjaan tapera habis gaji,0
201,gaji potong bpjs sehat pilih manfaat nggak eligible koma persen gaji iya manfaat,0
202,sih potong bpjs ketenagakerjaan sehat persen tapera abis gaji,0
203,potong bpjs ketenagakerjaan bpjs sehat berat detail fungsi karyawan swasta,0
204,persis kayak bpjs sehat asal askesnya pns inti sih bijak dulunya pns generalisir swasta subsidi silang sih manfaat bp tapera,0
205,ngomong utama sehat lapang iur bpjs naik obat obat mahal beli nama guna bpjs orang sakit,0
206,jokowi teken pp tapera gaji kerja potong tabung rumah pegawai swasta kerja mandiri potensial iur bpjs sehat ruwet tuju dpr pp,0
207,dana haji ditilep uang kuliah naik bpjs sehat gaji potong buruh phk bumn bangkrut utang roket harga bbm lu bilang tang jokowi indonesia sejahtera adil makmur serah,0
208,potong pot bpjs tk sehat kerja berat,0
209,bpjs sehat bpjs tenaga kerja jht pph nambah kolom tapera abis gaji potong,0
210,bpjs sehat tapera rumah ladang perintah cari duit esemka ilang kabar gimik kampanye kemaren pindah ibukota sok sok,0
211,tapera yaa banget iur bpjs sehat tenaga kerja taspen abis gaji potong,0
212,goblok baca hutang mana potong hutang goblok potong bpjs sehat ketenegakerjaan pensiun potong dana sosial potong uang koperasi paham lo dul,0
213,iur bpjs sehat naik perintah nilai hormat ma,0
214,jamin sehat bpjs milik rumah tapera rakyat indonesia tuntut mandiri negara kelola habis uang gaji,0
215,bilang rumah anggap sumbang nggak iur bpjs sehat bilang serah,0
216,gua nggak kesel perintah tambah potong persen dah nggak pph bpjs sehat bpjs ketenagakerjaan tunjang tua sistem gimana tapera mending bantu rumah murah,0
217,fakta bicara gratis sistem kapitalisme sehat tanggung negara alih individu bpjs negara lepas tangan sangkal,0
218,muncul bpjs jilid potong ketenagakerjaan potong sehat potong rumah nih ntar gaji arisan muter bae sampe tuek,0
219,gugat ma mk paham sebenernya harap banget perpu ramein biar gugat kayak naik iur bpjs sehat,0
220,sistem kayak bpjs kek berat deh tinggal sehat sih duit korupsi mari pantau,0
221,liat detail potong slip gaji bpjs sehat persen tk persen ditambahin tapera persen karyawan kena potong enam koma persen abis,0
222,digabungin potong bpjs tk sehat sedih,0
223,asn bumn swasta media wajib nasional bpjs sehat rumah iur tapera pensiun dana pensiun sdh potong upah karyawan,0
224,tah persen gaji potong bpjs sehat bpjs tenaga kerja,0
225,pusing habis bayar bpjs sehat rate ubah ubah,0
226,ribu orang menandatangani petisi isi tolak naik iur bpjs sehat naik iur pandemi nilai hidup masyarakat sulit,0
227,serah lu dah ntar duit ilang tinggal ngomong salah kelola kayak bpjs sehat,0
228,beban bpjs sehat bpjs naker potong lg maksud pa jokowi manfaat potong kerja,0
229,ngitung bpjs ketenagakerjaan jht porsi karyawan jp porsi karyawan bpjs sehat premi porsi karyawan tapera potong nambahin kerja hrd,0
230,tuju sehat juang lawan corona de naik anggar bpjs mbak rika cipta salah anggota pdi tolak tolong,0
231,baca pp no ribu puluh tabung rumah rakyat presiden cinta jokowi nambah nih pungut paksa gaji taper tambah bpjs sehat ketenagakerjaan sisa gaji tinggal kartu,0
232,plus swasta kayak askes jamsostek lebur jd bpjs sehat,0
233,perintah tolong gaji side job seret naik bpjs sehat persen potong subsidi rumah orang gitu nyicil rumah,0
234,manfaat situasi tagih bpjs macet operasional rs lumpuh bijak larang kumpul area publik minim pasu layan sehat,0
235,tapera jatuh kayak bpjs sehat bpjs ketenagakerjaan paksa,0
236,coba rs khusus ortopedi surabaya kayak operasi wa telfon csnya bilang obat sana pakai bpjs sehat barusan konfirmasi dichat coba henti,0
237,ngurus gatau serta bpjs sehat wajib autodebit ngelampirkan atm buku rekening ngisi formulir tuju autodebet bank kait tau wajib bayar bebas,0
238,lu sadar tax ratio bawah belas persen lu sadar serta aktif bayar bpjs sehat cuman puluh koma tujuh persen ngomong ideologi liat statistik lapang,0
239,kurir salah usaha logistik bumn kasihan bpjs tenaga kerja bpjs sehat cabut semenjak kerja antar brng jalan,0
240,heran iur bpjs bayar tenaga sehat,0
241,jamin paksa asuransi sehat tambah paksa bpjs oh cebong pantes bego kaya si joko,0
242,bp jamsostek ketenagakerjaan bpjs sehat eh adalagi bp tapera hadeuh dapat bayar iur mulu,0
243,bpjs sehat tanggap keluh serta bpjs konfirmasi sulit banget balas dm,0
244,budget segitu bpjs dapetin fasilitas sehat doang untung untung dapet rs emang layan bpjs bagus,0
245,sehat hati tanggung bpjs,0
246,ngeluh bpjs jaga sehat,0
247,emosi gara gara layan bpjs sehat bener antara tanggung loh bikin tension headache benernya sih layan merosot ngurus bpjs sehat bikin badan sehat,0
248,amerika utang rakyat jamin orang nganggur dpt tunjang leher jerat naik bpjs uang jamin sehat amerika sehat jamin negara lo cebong ngepet,0
249,ngakak sih kena prank bpjs sehat iur,0
250,gimana iur bpjs sehat putus mk tolong bilangin jokowi jgn suka langgar uu gimana rakyat sableng ajarin bener,0
251,pro rakyat harga bbm tarif listrik bpjs sehat bikin nang,0
252,bayar tagih kartu sm bpjs sehat kelas suka vertigo gerd bikin pusing,0
253,biaya bpjs sehat gin turun berat,0
254,pimpin tdk moral petinggi negara ngatur bbm harga ngak turun caplok freeport ngak jamin sehat ngak,0
255,pancasila air beli lapang kerja gampan usaha saldo nol ngejar harta harta titip tuhan pancasila iur sehat,0
256,miris bpjs pandemi kunjung reda,0
257,biar kagak lupa orang gantung bpjskesehatan istri lahir mending langsung rs deh faskes apa nama langsung rs biar susah ngurusinnya,0
258,cukai naik deh subsidi bpjs sembari ngerokok amal ngomongin dampak buruk sehat soft drink sehat rokok energy drink bebas lenggang biar bpjs naikin iur berat masyarakat,0
259,didik gratis sehat gratis bpjs nunggak listrik subsidi diem diem rangkak pertamina tolak ukur gejolak aneh berat,0
260,bpjs tk sehat gopek ngabisin gaji,0
261,kalimat kau bilang merdeka bukti nama merdeka damai rakyat tdk sengsara sehat kerja jamin negara bpjs naik iur kerja pake tka,0
262,iur bpjs,9
263,iur bpjs sehat masyarakat tanggung perintah,0
264,free country green cardbya liat gonjreng gt propaganda mah sistem sehat bpjs kagak,0
265,perintah pikir keras baik sistem bpjs sejajar layan asuransi sehat tdk anggap sumbang bantu rakyat tdk banyak dokter layan lapis masyarakat dlm terima fasilitas sehat,0
266,rencana naik iur bpjs sehat nilai cacat hukum,0
267,kemaren sakit kudu pis rapid test mahal tanggung bpjs jaga sehat,0
268,naikin tarif bpjs sehat ngeluh tambah nih menteri gaji pake uang rakyat,0
269,iur bpjs sehat daya beli masyarakat rendah sulit,0
270,gin bpjs bubar nabung segitu kali tujuh keluarga membackup sehat keluarga,0
271,iur gin orang mending bpjs asuransi lbh murah,0
272,bpjs sehat produk asuransi paksa berat masyarakat,0
273,iya kalang tengah ancam miskin pandemi permasalahin tengah pandemi notabene kaya sampe miskin kena imbas pake bpjs sehat sih emang masalah pake bpjstk,0
274,anjing dipikirin nominal duit melulu lo tau bpjs hak sehat warga wajib negara,0
275,perintah mata duit iur dinaikin ngeberatin,0
276,bayar pajak bayar iur bpjs terobos bpjs laku transformasi digital radikal pakai mindset startup digital laku tingkat sehat masyarakat,0
277,bpjs sehat mudah masyarakat,0
278,naik iur solusi atas defisit bpjs sehat,0
279,bpjs sehat kecewa ribet koordinasi jadi minggu istri gugur dikiret klinik utama handayani bpjs aktif,0
280,rakyat susah disusahin contoh pimpin sadis dzolim rakyat,0
281,cekik usaha rakyat brutal naik bpjs sehat dibatalin ma ganti ketua ma naik peras pd usaha rakyat sadis nggak sih prank itu nama iur bpjs sehat,0
282,sentralisasi sehat bpjs tekor mesti tara puskesmas kelola jamkesmas kab kota tara rsud kelola jamkesmas prov tara rsup kelola bpjs pusat atur persentase kelola layan sesuai anggar,0
283,pegawai bpjs pakai bpjs sih iur bpjs sehat putus ma,0
284,bpjs sehat pajak wajib anggota mati bayar mati stop bayar cie indonesia sengsara rakyat,0
285,bener bener rezim cekik rakyat naik iur,0
286,bpjs bentuk subsidi sehat negara gin cerita ragu negara ngasih subsidi rakyat rakyat ngasih subsidi negara,0
287,oi bego emergency bidang sehat benah bidang sehat bpjs tangan covid infrastruktur,0
288,modus jahat berfikir sesat kondisi masyarakat serba susah covid sisi kait defisit bpjs sehat rakyat korban,0
289,iur abis mundur ganti kelola tata kelola ngga beres iur alas,0
290,tau wajib bayar bpjs bulan biaya sehat olah harap sakit sakit duit bayar bayar pegawai bpjs,0
291,bikin emosi bpjs sehat minggu dikerjain bolak sampe muter muter ujung kabupaten sampe ujung kota tengah psbb dilayanin tanggung,0
292,orang cocok bpjs orang orang cari asuransi sehat swasta alas cari layan cepat langsung optimal bpjs ribet administrasi,0
293,kayak bpjs sehat nih adaptasi revolusi industri ada,0
294,jerman sosialis sistem sehat asuransi tinggal dateng gk pake ribet indonesia gelut pake bpjs,0
295,sih bpjs asuransi pt prudential life assurance prudential pt aia financial pt asuransi jiwa manulife indonesia axa mandiri layan sehat cepat,0
296,jokowi gotong royong tengah pandemi naik iur bpjs tengah darurat sehat landa bangsa,0
297,serah bilang kisdi nuduh org bnr fitnah org nanya bpjs sehat iur berat masyarakat hutang negara nyari kerja susah isi tka,0
298,udahlah bubar bpjs sehat nyusahin masyarakat doang bisa,0
299,sih pindah jamin sehat swasta bpjs kelas mata rumah sakit anggap pasien bayar ngutang bayar bpjs perintah rumah sakit telat,0
300,naik iur bpjs sehat nilai cedera manusia,0
301,bagus hasil bayarin utang bpjs sehat biar iur berat masyarakat,0
302,bubarin susah masyarakat jg manfaat benefit bpjs sehat jujur manfaat bpjs tk org jg bs daftar sbg kerja mandiri manfaat lbh kayak nabung deposito,0
