,words,cluster
303,geruduk dirut bpjs sehat naik iur pihak masyarakat,0
304,tau main tarif bpjs sehat,0
305,naik iur bpjs sehat harap baik layan sehat idi nilai sulit bayar fasilitas sehat,0
306,dpr nilai perintah manfaat social distancing lolos naik iur bpjs sehat,0
307,bpjs usaha cari untung usaha jalan wajib negara jamin sehat masyarakat,0
308,bpjs bubar sistem sehat rakyat urus pemda rugi masyarakat,0
309,ini asuransi jenis nanggung sehat negara rakyat pasung nama bpjs,0
310,bpjs sehat covid harga sembako turun,0
311,bantu rakyat covid salah satu turun bbm boro boro turun naikin iur bpjs negara sih,0
312,negara jamin sehat gratis iur sehat iur,0
313,naik iur bpjs sehat nilai sengsara rakyat pa gugat jokowi,0
314,naik iur bpjs sehat perintah akal putus ma empati sulit rakyat,0
315,hampirgila habis pandemi rsj penuh pasien alas perintah naik iur bpjs alokasi anggar proyeksi sehat jiwa sadar naik iur gila masyarakat,0
316,nutup defisit bpjs sehat rakyat peras koma enam trilyun setor abal abal,0
317,layan bpjs buruk obat rs mending pake asuransi swasta dah iur kelas segitu diturunin mesti tahun kelas sampe gk urus jd mandiri resign mesti kudu jaga sehat,0
318,negara renggut hak rakyat polemik iur bpjs sehat kunjung,0
319,tanda perintah tdk solusi sejahtera sehat rakyat abai suruh turun kelas bpjs sehat defisit tdk duit klau masyarakat turun kelas uang nutupi kurang jd liat akal akal,0
320,mending pindah asuransi swasta bu sri bpjs rs susah suka ruang,0
321,rasa gambar bijak jokowi naik iur bpjs sehat,0
322,bahasa hebat banget rakyat selamat bpjs mana peran negara perintah selamat rakyat serba balik,0
323,bpjs wajib negara sedia fasilitas sehat alih dana prakerja real bantu masyarakat dr insentif ambil hak rakyat suruh ambil hak jabat lembaga negara daerah,0
324,bpjs langsung pake korelasi budget orang ngerokok eh coy ikut bpjs sehat ngerokok goblok,0
325,bpjs bubar sehat rakyat urus pemda biar timpang,0
326,perintah nge prank gin rakyat buat sakaratul maut mgkn bpjs sehat udh batal paksa besar gaji karyawannya,0
327,naik iur bpjs sehat nilai jatuh marwah mahkamah agung,0
328,perintah milik empati masyarakat,0
329,tuju rakyat susah perintah naik iur sehat korban phk sakit sakit stres akibat naik bpjs,0
330,presiden joko widodo patuh putus mahkamah agung bpjs sehat,0
331,sulit perintah nekat naik iur bpjs sehat mana pihak rakyat,0
332,perintah peka bukti tuna empati situasi masyarakat landa pandemi wabah covid mana masyarakat susah derita naik iur bpjs sehat,0
333,ma batal naik iur bpjs sehat presiden naik,0
334,naik iur bpjs sehat jokowi rasional,0
335,banget pandemi naikin iur bpjs sehat,0
336,tuju bpjs ada ladang dapat sehat rakyat,0
337,pecat dirut bpjs sehat bukti,0
338,naik iur bpjs sehat tanda negara duit rakyat peras,0
339,pasien bpjs lawan putus presiden naik iur bpjs itupula harap layan pasien fakta beda lapang kelas sosial layan sehat pilih kasih,0
340,lha bpjs jg ka asuransi sehat jel kl non ksntor blm si pgn jg tdnya sih pruden jel,0
341,new normal pengaruh uu sehat bpjs patah hati amp rindu tanggung bpjs,0
342,geram sikap presiden jokowi naik iur bpjs sehat batal ma sayang putus ambil sulit ekonomi rakyat akibat dampak pandemi covid,0
343,dear bpjs sehat please go digital bahas bahas orang dendam,0
344,tolong up nista agama tebar benci habis ml,0
345,knapa pos nda suntik dana lapang cabut hak bpjs sehat ketenagakerjaanya,0
346,resesi org demen alokasi dana kredit hp motor resesi sehat jd nomor sekian bayar bpjs protes,0
347,bpjs sehat biar kucing jilat wajah,0
348,loh kelas dirut tvri g tau wajib iur bpjs karyawan bayar lgsg potong gaji karyawan masuk dlm tunjang sehat duh gustiiiii ora enek sing luwih pinter po,0
349,woooiii kasih biaya rakyat rakyat hidup pajak bumi bangun pajak kendara pajak hasil pajak sehat bpjs,0
350,nti uang otomatis masuk tunggak bpjskesehatan kak bs obat hati kecewa husnuzon,0
351,kuat sehat naik bpjs,0
352,jamsostek kolaps susul bpjs sehat,0
353,lupa bayar bpjs sehat pas bayar wow akoe terkedjoet,0
354,rakyat pelit hitung an bumn jor joran perintah gelontor uang bumn tengah pandemi virus corona satu sisi perintah pelit kikir bangat tutup defisit bpjs sehat,0
355,bpjs it feel so high damage bossque jamin tingkat kualitas layan sehat bpjs negara defisit anggar akal sehat,0
356,cek iur bpjs sehat apk mei bayar april gilir bayar bca mbanking tulis tagih bayar gimana woy bentar tgl juni tar gua kena denda engga gara telat bayar mei ini otak emang,0
357,iur bpjs sehat resmi pandemi,8
358,krn negara biaya makan napi lepas krn jamin sehat iur bpjs naik krn subsidi bbm tdl subsidi cabut krn kerja layakkpd rakyat lapang kerja cm tka china,0
359,iur bpjs sehat resmi pandemi covid,5
360,naik iur bpjs negara status darurat sehat terap new normal positif mati tingkat government ambyar kebohonganbaru,0
361,nemu cuit bpk naik bpjs kait penting sehat rakyat sesuai amanat uud pasal tuan mana diem doang stop bohong tutup bohong,0
362,iur bpjs sehat perintah konyol cabut putus rugi rakyat,0
363,alas naik bpjs sehat gugat milik empati konyol,0
364,trs pdip buat rakyat indonesia sembako or blt or cuman bs cela pimpin dki jakarta kerja rakyat indonesia bs ap cuman bs ny naikin bpjs sehat listrik sm harga bbm rugi rakyat indonesia yah gt,0
365,bangsat iur bpjs sehat resmi pandemi covid,0
366,iur bpjs sehat resmi pandemi covid serba serbi mmc perintah keluar bijak luka rakyat tengah pandemi covid iur bpjs sehat resmi protes kecam dr kalang,0
367,negara biaya rakyat bbm haruse turun turun bpjs sehat haruse isa gratis naik kl isa juang rakyat munduro ae cc,0
368,presentase rakyat miakin era turun bpjs sehat juta jiwa rakyat miskin tanggung negara orang kaya bpjs tanggung negara,0
369,politis gerindra level rakyat jg hak jamin sehat selamat jgn bpjs naik pajak tinggi gilir penuh butuh pokok rakyat gratis bulan sanggup,0
370,trs kerja kelen bijak rezim dongok simpang abai adil sejahtera sehat makmur rakyat cukong bebasin koruptor jeblos ulama mana suara ttg listrik bpjs bbm bacot abnormal,0
371,rakyat trs terus bayar pajak negara pajak kendara pajak bumi bangun pajak hasil bpjs sehat jg hrs dibyr,0
372,anjing iur bpjs sehat resmi pandemi covid,0
373,iur bpjs sehat resmi pandemi covid perintah keluar bijak luka rakyat tengah pandemi covid jamin naik iur tingkat kualitas layan sehat,0
374,fungsi new normal pengaruh bpjs askes sehat rakyat cover,0
375,klo balik gimana rakyat dah lelah mbiayai negara pph ppn pbb listrik mahal bbm mahal bpjs sehat negara hidup rakyat negara gerak mungut peser rakyat klo emang bukti jalan,0
376,iur bpjs sehat resmi pandemi covid perintah keluar bijak luka rakyat tengah pandemi covid iur bpjs sehat resmi protes kecam kalang,0
377,iur bpjs sehat resmi pandemi covid serba serbi mmc perintah keluar bijak luka rakyat tengah pandemi covid iur bpjs sehat resmi,6
378,woii bayang tutup derita kanker gagal ginjal cuci darah derita sakit butuh biaya tolong,0
379,sumpal kapital tanggung jawab negara sehat rakyat jurus palak ala bpjs naik jaga satu nkri sah ruu hip peluang bangkit pki peduli negara nyawa rakyat jk akses tka buka pandemi,0
380,rakyat terus bayar pajak bpjs kaya apa rakyat rakyat rakyat cari nafkah bantu fakir miskin pelihara klean mesti cuci tangan pakai masker jaga sehat,0
381,sektor sehat bpjs suntik suntik,0
382,gilir amanat uud pasal layan sehat perintah naik iur bpjs sehat situ mingkem wakil rakyat prettt,0
383,iur bpjs sehat resmi pandemi covid serba serbi mmc perintah keluar bijak luka rakyat jamin naik iur tingkat kualitas layan sehat,0
384,bpjs asuransi sehat dasar emang hak warga negara asuransi sehat swasta manfaat untung bs luas fleksibel butuh mampu,0
385,bpjs sehat defisit kabar gaji tenaga medis d potong salur bantu garda depan covid d utama kemenbumn,0
386,gebetan tikung temen ups rela kejar,0
387,tolak lupa delapan mantan menteri sehat siti fadilah supari bahaya bpjs korban kapitalis harus bantu kapitalis,0
388,iur bpjs sehat resmi pandemi covid susah tambah susah astagfirullah,0
389,sehat jamin negaraa mas broo dlm uud presiden jalan amanah uud ekonomi negara persen bpjs naik bayang mas broo masyrakt hrus bayar bulan rb coba maka otak orang miskin,0
390,turut gausa subsidi samsek bbm ken subsidi bbm ujung utang pertamina mending dialihin bpjs didik sehat jabat gendut doang otak,0
391,alami migran ampun deh kena migran sakit kaya ketok palu biaya gimana obat,0
392,banyak mikir sakit tambah parah berat naik iur bpjs sehat,0
393,prnah dnger istilah potong kuku jari umpama kayak cocok analogi kondisi bpjs sehat,0
394,tenaga kontrak siar tvri egk dapet bpjs sehat bpjskesehatanri bpjs ketenagakerjaan bpjstkinfo egk thr liput musibah hujan longsor dsb gaji egk ontime kadang bayar,0
395,covid nambah bpjs kolaps sistem sehat runtuh nakes sakit lo nulis surat waris gaada guna,0
396,allah ngenes iur bpjs sehat resmi pandemi covid hidup rakyat iris,0
397,bpjs sehat resmi pandemi covid dzalimnya kuasa rakyat,0
398,gonjang ganjing banyak serta keluar jalur pbi jelas bpjs sehat,0
399,new normal fasilitas istimewa jabat lucut hasil sama umr kantor angkut sepeda motor mobil tnp iring iring fasilitas sehat bpjs blh milih kelas tdk prioritas apa piye,0
400,nutupin defisit bpjs sehat rakyat peras iur naik hadap menanagi corona covid rakyat suruh gotong royong sumbang gaji potong gilir penting kuasa cukomg perintah gelontor dana ratus triliyun,0
401,desa kota puskesmas klinik fasilitas sehat mumpuni rsud sistem antri bpjs herd immunity depopulasi rakyat,0
402,loh kaya kaya ttg pandang prioritas ttg sehat iur bpjs kelas naik knp pakai kelas gengsi makan tuch gengsi gratis daftar program indonesia sehat beres,0
403,mending bubar ruwet kelas hapus atur serta bpjs sehat,0
404,bijak naik tarif bpjs saat pandemi bijak miskin empati zalim upaya liberalisasi bidang sehat langgar konstitusi,0
405,gila bijak bpjs sehat untuk layan sehat masyarakat masyarakat balik tekan anggap beban kuasa bijak lindung bkan tindas warga,0
406,haris azhar rezim era jokowi kali abai hukum putus ma perintah presiden jokowi tentang putus ma naik iur bpjs sehat,0
407,bisnis tega hukum lihat kiwari hakim ma putus tolak naik tarif bpjs uji materi judicial review pp no jamin sehat rezim putus batal,0
408,rezimberjutakasus rezimberjutakasus jokowi nilai lembek psbb naik iur bpjs sehat download link,0
409,maaf uu no puluh thn ribu sebelas revisi masalah dlm bpjs sehat lanjut isi uu timbul polemik mustahil bhw hadir covid salah kutu uu,0
410,naik iur bpjs sehat perintah main rakyat rezimberjutakasus rezimberjutakasus,0
411,negara subsidi rakyat rakyat subsidi negara ms didu akun twitter uu bpjs peras rakyat perintah negara ambil alih tanggung layan sehat,0
412,phk penggaguran tambah bpjs nunggak bpjs tdk layan nunggak kena denda puluh jt rezimjokowipemusnahrakyat nunggak bpjs sehat ancam denda puluh juta,0
413,tuju gilir naikin listrik bpjs peduliin mampu rakyat negara milik sih tuju bentuk bpjs bantu masyarakat dlm bidang sehat peras rakyat,0
414,ngawur bijak rezim selamat isi perut pikir rakyat bye bye kelas serta bpjs sehat hapus,0
415,jokowi nilai lembek psbb naik iur bpjs sehat,2
416,mudah omong bos asbun knalpot nyaring bunyi negeri kali urus sehat dicover bpjs mudah tercover kritik nyinyir om msaiddidu stopprovokasiditengahpandemi,0
417,kpk tata kelola buruk bpjs sehat potensi rugi negara,0
418,tarif iur bpjs sehat bpjs jamin kualitas layan kelas bpjskesehatan,0
419,krn perintah gk duit nyuntik bpjs kelas bpjs sehat kelas,0
420,juta manfaat maman iur bpjs sehat judul berita mewah isi henti click bait judul taik,0
421,rakyat peras vs bpjs berpoya bpjs tangan sosial sehat rakyat tatakelola,6
422,tegas perintah payah disiplin warga psbb panjang jalan padat bandara pasar mall penuh orang tolol naik iur bpjs sehat ubah jadwal cuti dadak sy bingung sedih teriak kontol,0
423,keluarga putus henti bayar sda atur kelola sejahtera rakyat jual murah rumah sakit sehat diliberasisasi asai swasta bikin bpjs dalih iur negara tukang palak,0
424,jokowi naik iur bpjs sehat pemkot solo bayar angsur premi mei jokowi bpjs merahputih,0
425,putus presiden jokowi naik iur bpjs sehat gugat gugat atur presiden pres nomor aju mahkamah agung ma jokowi bpjs sehat,0
426,komunitas pasien cuci darah gugat naik iur bpjs sehat,0
427,nunggak bpjs sehat ancam denda juta denda kali lipat persen hajaarr tross rakyat perass kasih kendor yaa,0
428,iur bpjs sehat gugat,2
429,anggar bayar premi pemkot surati bpjs sehat,0
430,politik hukum dri bentuk uu bpjs penuh hak sehat rakyat indonesia wajib perintah jamin sehat stlh keluar pres no thn cenderung wajib beban rakyat,0
431,sbuah institusi negara terang lawan hukum membngkang trhdp putus pngadilan bpjs sehat case abam reformasidikorupsi,0
432,staff bpjs asuransi sehat bpjs kes,0
433,salah bpjs mala rakyat kuasa nama iur sehat,0
434,ansori siregar naik bpjs sehat bentuk paksa masyarakat,0
435,naik iur bpjs sehat gugat gugat nilai ego sektoral tribunnews,0
436,indonesiaterserah jokowi nilai lembek psbb naik iur bpjs sehat,0
437,baru bpjs sehat defisit tulus abadi salah okok,0
438,jakowi gugat gara gara bpjs sehat,0
439,nunggak bpjs sehat ancam denda juta denda lhawong bayar iur berat bayar denda sak karepmulah sak neng puas-puasno kunu,0
440,serta bpjs sehat tunggak bayar iur henti serta,0
441,nunggak bpjs sehat ancam denda juta stress rezim orang susah naik denda,0
442,nunggak bpjs sehat ancam denda puluh juta,3
443,gila gin negara cari uang dah bubarin bpjs bpip rakyat ancam nabung celengan bebas denda tunggak bpjs sehat ancam sangsi denda puluh juta,0
444,btw paksa pake bpjs sehat ketenagakerjaan kerja bumn bpjs ketenagakerjaan udh beres cair tinggal nonaktif bpjs sehat henti alas bpjs haram judi stfu bpjs,0
445,kasi rakyat sembuh dr sakit hrs tanggung beban tunggak tanggung smp persen naik moga tumbang rezim amiiinnn nunggak bpjs sehat ancam denda puluh juta,0
446,denda mahal banding iur bpjs sehat sehat otak bpjs sehat instansi jamin sehat rentenir lintah darat tunggak bpjs sehat rumah sakit rekan bayar malu,0
447,asuransi jamin sehat beda asuransi profit oriented jamin sehat nasional jamkesmas rubah jd bpjs tuju jamin sehat dr negara mmg layan rakyat ambil untung dr rakyat layak usaha swasta bumn,0
448,bantu rakyat naik iur bpjs ugal ugalan kuasa hukum kpcdi rusdianto matulatuwa naik iur bpjs sehat jilid empati sulit warga pandemi corona,0
449,kuta trauma belasting diri badan selenggara dana pelihara sehat cikal bpjs sehat kait seleweng tata kelola uang negara orba lanjut rezim,1
450,bpjs vs layan sehat khilafah tegak,0
451,sumpa yah sakit hati nakes rendah salah manajemen rs bobrok salah nakes bpjs atur nakes salah atur tri sehat tetep nakes salah jarang kata bantu apa,0
452,umur bpjs biro dukung jokowi stress tarix jabrix kaaaang perintah hapus kelas serta bpjs sehat,0
453,iur bpjs pas sedih sedih salah bukti bagus layan sehat khilafah papar sejarawan bangsa amerika will durant rumah sakit al manshuri kairo,0
454,krisis pandemi muncul gelombang anggur angka miskin tingkat beban ekonomi negara berat kondisi buruk sehat tata kelola bpjs sehat dampak naik iur premi pandemi,0
455,bubar bpjs dinas sehat dinas sosial daerah tangan butuh masyarakat obat jamsostek rumit rakyat obat rumit banyak cincong titik,0
456,hilang wo bpjs sehat premi ambil sehat jatuh tempo uang nambah ngurang ngomongin sisi investasi si asuransi poko asuransi pikirin manfaat uang,0
457,animal husbandry student prinsip bpjs sehat gotong royong tindas,0
458,situasi blm kondusif,0
459,intan fitriana fauzi rakyat tangung beban defisit bpjs sehat,0
460,tengah ancam wabah corona jokowi tega laku pres nomor enam puluh th ribu puluh ubah pres nomor delapann puluh th ribu delapan belas jamin sehat muat naik bpjs,0
461,presiden bpjs karna defisit ma batal naik bpjs perintah juli bpjs rakyat turun kelas melarat lihat rakyat peras alas defisit berbed negeri rakyat gratis biaya sehat,0
462,baju sehat bpjs kelas ngeluh kuat bayar pas mall buka langsung serbu belanja,0
463,menganalisa behaviour kelas tengah susah gampang pas iur bpjs kelas bilang susah kelas pas mall buka hambur belanja belinji kerumun indah protokol sehat psbb ancam covid,0
464,klo q sih tuju subsidi sehat bpjs klo pakai miskin obat perintah tanggung biaya,0
465,bpjs sehat skema asuransi ajar cina ambil konsultan asuransi sehat usaha china pantes ngikut,0
466,hhmmmmm iur bpjs sehat serta tunggak subsidi,0
467,mrk golong kelompok bpjs subsidi negara kelas jd mrk peduli sehat orang hepi ngapain susah,0
468,bpjskesehatanri pergi kantor bpjs sehat pakai jkn mobile psbb pergi situs suruh kantor bpjs pusing,0
469,suruh jaga sehat rumah ngeyel gilir bpjs rintih sengsara maki perintah dasar waluh godok goblok,0
470,narapidana bebas masuk sehat utama iur bpjs naik saat faktor ekonomi turun minyak bumi turun harga turun,0
471,pademi covid naik iur bpjs sehat miris rakyat,0
472,bayar bpjs sehat pd berisik bangke,0
473,bpjs bentuk ketidakmampuan negara dlm layan bantu obat sehat masyarakat pungut upeti masal ancam,0
474,muslimahnews sejal bpjs salah arah mala sistematis nama sehat layan sehat gratis kapital pikir hidup mati rakyat untung rugi negara,0
475,pake bpjs sembuh sembuh pulang ngerti deh bpjs ngomongnya asuransi sehat eh serta sembuh bawa rumah sakit make bpjs bayar bulan laku beda,0
476,perintah gesit kasih uang bumn pelit bpjs sehat defisit,0
477,iur bpjs sehat mandiri butong main main urus rakyat,0
478,politisasi bpjs bantu negara jebol apbn tanggung sosial negara tanggung nilai ambil misi negara bantu orang miskin akses layan sehat,0
479,nakes klinik bpjs ku daftar anggota jamin sehat tsb huft,0
480,haram ubah ente laku ajar fakta bpjs akad transaksi haram bpjs salah satu islam kenal asuransi sehat ketidakjelasan pinjam manfaat bpjs hadiah,0
481,mahal e ratus puluh rb bpjs sehat pet,0
482,akal rezim rezim tukang ngakalin rakyat putus ma kait iur bpjs sehat langgar jabat presiden periode akal,1
483,nyata sikap gsbi tolak naik iur bpjs sehat tuntut cabut pres nomor enam puluh ribu puluh salam demokrasi pandemi covid tengah situasi ekonomi rakyat merosot,0
484,mkan susah mo byar denda nasib nasib terserahloedeh nunggak bpjs sehat ancam denda puluh juta,0
485,cemanalah org fokus covid fokus naik iur bpjs sehat terserahindonesia,0
486,sehat tanggung negara gabisa atur tangan maksimal ngomel mentang bpjs bingung,0
487,kl slalu berfikir kasih nama bpjs jaring sosial tarif ganti nama asuransi negara uang urus sehat rakyat point tekor,0
488,iya jg heran ngomong skrg mobil esemka gmn kabar hyundai salah tim favorit juara ajang wrc esemka produksi bpjs sehat defisit salah kelola,0
489,rezim tindas kuasa gilir naikin iur lambung laku juli gilir turun kelas tunggu bpjs sehat defisit salah kelola gaji direksi rakyat korban,0
490,sy tdk protes naik iur bpjs jokowi bubar bpjs kembali tanggung perintah kait sehat rakyat tanggung badan usaha bpjs bpjs waris buruk rezim sbyudhoyono pd tindas ketimbang gotong royong,0
491,lha iyo bancak jokowi hadir selesai jabat jahat rakyat alat iur iur bpjs sehat alas defisit,0
492,emang lo bpjs sehat mandiri sanggup bayar surat terang miskin lurah biar lo keluarga tanggung negara rezim arab saudi firaun naik pajak biaya umroh haji rezim arab saudi firaun,0
493,guna dpri rapat paripurna habis miliyaran duit negara unyuk bahas bpjs guna yahh presiden naik iur sehat tenang politik diam jilat tenang lupa rakyat,0
494,bubarin skalian bpjs pemrintah jgn main asuransi jamin keshtan rkyat sesuai sj kmampuan ngara biar bisnis kshtan swasta rkyat ken sht tdk hny lwt medik sontoloyo gtongryong dijdkan alas kedok bisnis sehat,0
495,asuransi sehat lambat bayar denda asuransi sehat wajib org bpjs dr jmn sby rusak rezim skrg aku sh junjung gagal urus bangsa,0
496,bpjs sehat defisit salah kelola salah rakyat lagi,0
497,si cocot otak mampet bpjs layan sehat masyarakat kalsu uang layan jalan sesuai pd stop total,0
498,bubarin bpjs beres sulit butuh prosedur famili teman sakit parah gk bpjs lgi contoh doa dzikir smoga alloh sehat berkah,0
499,sehat hukum jadi tonton sirkus hibur naik bpjs batal ma sambut atur muatanya atur naik bpjs jadi putus ma konsideran lucu negri jenaka,0
500,bpjs core bisnis sehat kesejahteran kelola tdk rakyat indung konyol coba liat gaji,0
501,bpjs rawat inap sngat bgs rwat jln enak tmpat sy krj sakit cover kntor bijak alih bpjs pemeintah kecewa hrs syukur org bs rasa layan sehat skrng rawat jln mending biaya,0
502,bpjs pandemi covid bijak bijak bilang anggar bisa alih covid iur sehat masyarakat manfaat situasi tengah pandemi gimana,0
503,orang sakit enak orang bodoh harap bpjsnya syarat bpjs sehat orang tsb sakit,0
504,omong mreka sengaja biar dengar masyarakat awam pikir perintah beban rakyat naik iur bpjs sehat tuju subsidi silang jd naik iur naik,0
505,akibat rezim ambil sempat dlm kondisi skrg harga bbm segitu turun untung dalam gk untung tsb ringan fasilitas sehat rakyat sprti bpjs gk brrti mana lari untung tsb,0
506,iur bpjs akibat serta tertib bayar iur bandingin askes sm bpjs bpjs kes masyarakat paksa investasi sehat pola hidup sehat neg sakit perintah nanggung cuk utekmu goblog men lho,0
507,woi anjing manusia kikir lo bpjs subsidi silang warga miskin gk bayar bpjs bantu perintah membiayain awat corona bpjs lo murah asuransi sehat lo inget yah bpjs mahal krn subsidi silang rakyat miskin,0
508,naik iur bpjs sehat kondisi masy sulit pandemik covid bijak tdk pakai akal sehat sgt berat masy fasilitas sehat,0
509,kondisi sehat buruk spog nanganin sub spesialis fetomaternal kontrol muahal bujang bahagia bpjs cover lho terimakasih bpjs,0
510,dear all perintah dah ngga mikir ngga mundur baik sbg warga negara jd serta bpjs sehat sdh bayar kelas 1 ayo rame pindah kelas biar dpt subsidi sriotakmukemana,0
511,dampak akibat naik iur bpjs sehat turun kelas bayar naik dicover bpjs,0
512,sy jg hidup sejahtera bos sy harap perintah sy harap perintah presiden jaga kondisi negara aman biar bpjs sehat tdk salam,0
513,gimana bahas pakai bpjs sehat dampak akibat naik iur bpjs sehat owner sih bahas tau,0
514,sehat didik tanggung negara malakini rakyat bpjs,0
515,ajar politikus kampanye didik sehat gratis percaya lihat politikus koar pilih sehat gratis raka diam bpjs loh,0
516,konsep bpjs konsep konsep bpjs jalan sesuai bangun fasilitas mutu sehat rumah sakit daerah rumah sakit hak anggota bpjs batas kaya pesrta bpjs,0
517,iur segitu komplain bayar asuransi keeehatan non perintah ratus rb gabung test sehat bpjs dfn iur minim sakit tanggung serta tdk seleksi komplain,0
518,kalok udh tau sulit napa bpjs ngajuin keluarga miskin aj biar sehat d bantu perintah bpjs program bantu iur,0
519,bpjs rancang tuju bantu iur bpjs trus bayar perintah trus iur gimana nasib beda program sehat gratis masyarakat bayar urus pusat,0
520,tau brp hrg asuransi sehat cakup sakit cover sy tau brp hrg obat leukimia cuci darah seblm bpjs bpjs layan jelek tindas klo rs obat generik harga gpp sy blm sanggup byar asuransi swasta soale,0
521,rakyat miskin rugi naik iur bpjs rugi bela tolak naik iur bpjs sehat ngotot narasi bela rakyat miskin akibat naik iur bpjs sakit,0
522,jokowi tau dapat anjlok bpjs msh naik klo bpjs gk sanggup jd wadah rakyat ringan biaya sehat lbh bubar kembali program sehat perintah biar kaya bayar uang tdk bantu si miskin,0
523,jiahh situ ngga kuat ngutang ngga turun iur bpjs sehat,0
524,iur bpjs tuju jamin sehat nasional disalahgunakan keluh bayar pake uang sama jabat masyarakat ngerti stafsus smi,0
525,ngilu kacida weh geusmah bpjskesehatan bbm teu diturunkeun janji pimpin keur kampanye nu rek ngabela rakyat leutik,0
526,kerja rumah maha dahsyat kelola jamin sehat sosial masyarakat perintah benah spt mendahulukeun telur ayam mendahulukeun layan iur sadar sih bayar vs pakai bpjs,0
527,lhooo sadar serta jamin sehat sosial masyarakat tarik bayar duluan sakit praktek ndaptar bpjs bayar cari layan sehat pas sakit sih hehehehe,0
528,diturunin gaji direksi n jabat bpjs tenggang tenaga sehat kerja jabat bpjs kaya makan gaji buta manajemen ngak beres,0
529,emank mudah tuju negara bangsa jamin sejahtera rakyat rakyat nikmat hidup mewah hisab dana negara bilang subtansi bpjs sedia akses sehat masyarakat bwh,0
530,bpjs gimana nggak bangkrut byr iur mandiri hbs operasi puluh ratus juta sembuh nggak bayar iur gaji direksi bpjs jg jgn lewat tinggi tenggang tenaga sehat,0
531,optimal lahan tidur sbg kuari hasil untung daripada tuk bayar iur sehat warga bpjs sama kelas hak warga lokasi tsb serta bpjs kls bayar dr hasil kelola lahan kolektif tsb,0
532,bikin urung bpjs biaya orang sengaja ndak peduli sehat trus sakit orang kanker paru ngrokok orang gagal ginjal jaga makan pas diabetes,0
533,lbh risau rencana jangka tengah rasionalisasi layan program dasar butuh dasar sehat layan tanggung bpjs tara layan tingkat faskes puskesmas ngga aware tutup isu iur,0
534,anak orok lahir tau bhw jokowi sengsara rakyat lucu fikirannya dtg iur bpjs sehat naik tpi sdh sadar duluan bhw rakyat tunggak krn tdk byr tpi naik iur,0
535,saat perintah ngasih jamin sehat warga banyak guna bpjs muter otak biar makan orang model ckck,0
536,rakyat peras vs bpjs berpoya bpjs tangan sosial sehat rakyat tatakelola standar sejahtera pegawai ikut standar bumn murni bisnis lebih sejahtera pns polri dn tni salah akibat defisit,0
537,dungu bpjs sehat program bangtu bantu bantu jngan loe rusak ambisi bodoh loe,0
538,ulah oknum banget manfaat bpjs hilang masy gol tdk bs dpt akses sehat,0
539,gk ndleming asuransi sehat pyur premi juta org sebut usaha asuransi jenis asuransi gk ndleming asuransi tabung uang nasabah klo bpjs emg klo gk pakai uang iur ambil,0
540,bubar bpjs krn sjk lbh polemik nyaman direksi gaji ratus juta fasilitas spt jabat negara negara ngrsin sehat rakyat miskin tengah atas suruh asuransi sehat swasta sj,0
541,bpjs vs asuransi sehat pilih bpjs murah jamin mudah klaim iur tinggal ganti pilih asuransi sehat ngamuk hidup pilih cooook,0
