,words,cluster
542,gerombol kadrun netizen rame awal paham masalah diam bpjs sehat dah buka otak skrg kadrun netizen oon rame koment ttg new normal kemarin tuju gaduh satu rame awal,0
543,mau off serta bpjs sehat boleh bu jamin sehat notabene perintah wajib jamin sesuai amanat uud paksa ancam denda tagih debt collector,0
544,pdip aku alas perintah naik iur bpjs sehat rakyat marginal alas bokek pdip payah,0
545,maaf berat silah henti anggota bpjs cari asuransi murah gitu mana letak tanggung perintah sehat warga negara,0
546,kaji kpk akar defisit bpjs sehat inefisiensi simpang fraud naik iur bpjs nama rezim brengsek layak bubar,0
547,kagak peduli elu naik iur bpjs elu kagak maksa rakyat bpjs rakyat hak pilih program sehat mana program elu ndro,0
548,bener zalim iur bpjs sehat din syamsudin zalim nyata,0
549,jokowi kuat sejahtera rakyat sengsara rakyat turun pulang solo sial luh netizenemosinyasudahdiubunubun,0
550,sehat masyarakat jamin bpjs din juang banyak komentar solusi anak,0
551,hemm logika dungu klas klas drun klas gratis tetep gratis ngook loe goblok tung jadiin bumper orang kaya bayar bpjs bnyk asuransi sehat swata ajar malas ngetuit ma dungu akut,0
552,haiyaaa si udin ngamuk din syamsuddin tuduh rezim jokowi zalim thd rakyat naik iur bpjs sehat potensi jadi masyarakat patuh perintah,0
553,bahasa hebat banget rakyat selamat bpjs trus mana peran negara perintah selamat rakyat serba balik,0
554,kaum togok dungu maju bela bangga bangga,0
555,hancur krn salah milih pimpin tamat,0
556,anggota dpr ri dapil yaa bahasa lugas tajam aspirasi rakyat anggar sehat triliun knp iur bpjs sehat naik harus anggota dewan diam meng amin lawan,0
557,salah kelola rakyat korban naik iur bpjs sehat,0
558,dalih perintah urgensi gk tambal hidup lagintuh bpjs sanggah data rinci kontra perintah dah menfakui mafia sehat liat tindak berantas,0
559,iya bayar iur bpjs kelas bayar kuasa tunjnagan sehat buzze,0
560,goblok bego bs baca erti tulis dlm atur naik bpjs sehat bodoh,0
561,sedih sih dok sampe layan sehat msh kapital huhu bpjs berat,0
562,klo anggur bayar bpjs klo gk kerja serta ketenagakerjaan mas tdk dlm program bpjs msh ad asuransi jamin sehat kartu indonesia sehat skm jga penggauran jadi contoh,0
563,buahahaha iyain deh bpjs sehat ketenagakerjaan anggap konteks pdhl skali beda contoh anggur dy bs jd serta bpjs sehat bs jd serta bpjs ketenagakerjaan xixixi,0
564,jokowi sok tau usil sok nasehat deh urus perintah bpjs bertanggungjawab langsung kpd presiden jokowi,0
565,sanggup munduur perintah konstitusi jokowi bpjs sehat defisit salah kelola,0
566,pale lu peduli lu circle lu kaga peduli tenaga sehat rakyat kena imbas naik bpjs tdl sembako bbm situ sehat mikir otak,0
567,ra mashok ngerti ra mengatasnamakan negara poin mo nyindir rakyat ujung rakyat kambing hitam embel sehat pandemi hasyu perintah ngotak dikit kek dah duit bagi butuh jugak mentok bpjs tok,0
568,mala tpi masyarakat syukur bpjs jamin sehat jamin butuh kelas n kelas perintah subsidi,0
569,cukai rokok gunung bromo suntik dana partai bumn proyek proyek jatah uang jabat sehat bpjs paksa peras rakyat negara bodoh,0
570,pantesan orang naikin bpjs sehat ketua mahkamah agung turun bpjs sehat pensiun ganti sucks,0
571,rakyat rugi bijak salah arah vangke ramai ramai warga tolak naik iur bpjs sehat,0
572,kader partai korupsi syapi sok bela rakyat krn naik iur bpjs isi otak lup koleksi bini muda dasar manusia munafik bangst,0
573,naikin bpjs baik layan kualitas sehat rakyat badan selenggara bpjs defisit rakyat nutupin ras uang rakyat gaji hadir adil sejahtera rakyat,0
574,jahat kau zon klo kau corong suara rakyat kau dukung nikmat bpjs masyarakat zon masyarakat kelas berat naik fasilitas sehat,0
575,ketua mui dl bpjs sehat haram mbalelo jaman jaman bahaya waspadalahh,0
576,sadar sih tdk serta kelas orang kaya orang kaya engga pake bpjs mrk asuransi sehat fasilitas kamar vvip mahal empat sedikit pd rakyat nggak sanggup bayar iur bpjs menkeu nyuruh turun kelas,0
577,licik bpjs jamin sosial nasional sehat era kelola akal pakai asuransi,0
578,lu beneran g bpjs jamin sehat sok nama purapurabahagia niyee,0
579,simple bpjs sehat ramai servicing bener perangkat rumah sakit ramah pegawai benah bayar layan gitu pake bodoh,0
580,bohong jkn bpjs jamin sehat kapital bidang sehat butuh pokok wajib perintah rakyat bayar sistem mala,0
581,bpjs bentuk lepas tangan perintah wajib sedia layan sehat warga negara kapitalisme terap serba kapital mana hubung negara rakyat bangun atas hubung bisnis,0
582,pamor jokowi anggap jatuh gara gara naik iur bpjs sehat kali pamor jatuh buzzer agung,0
583,mending bpjs sehat dtiadakan sj krna klo hnya sengsara rakyat,0
584,auto bakar kartu bpjs sehat bakar naikin tarif takut dosa eh sebenernya dosa sih ngebunuh dajjal dosa takut penjara muak total si goblok,0
585,pola pikir jabat kayak gin oiya gaji aman sih defisit negara hadir meres rakyat orang kaya pake bpjs pakai asuransi sehat bagus bpjs turun kelas orang kaya,0
586,perintah pusat bpjs kelola asuransi jamin biaya sehat rakyat mending ngaku gengsi malu lha koq kasar kok ngaku pro rakyat urus sehat rakyat biar murah paham,0
587,apa alas naik iur bpjs wabah covid tengah sulit ekonomi masyarakat tanda putus bijak tdk peduli pd sulit rakyat alas klaim perintah naik iur bpjs sehat,0
588,naik bpjs sblm wabah covid corona gugat n menang ma proses hukum pk suk teriak mang klu sakit lsg bantuin rakyat contoh gakbener dki urus bansos manpu gmn urus sehat indonesia,0
589,idtodayco media kadrun narasi sesat pantesan kadrun tolol naik iur bpjs sehat jokowi sengaja sengsara rakyat,0
590,kelas tdk rakyat miskin gratis mo naikkin citra wawas ralat neh iur bpjs sehat wabah corona,0
591,mebel vs dealer amat politik rocky gerung pres jadi landas hukum naik iur bpjs sehat seoalah tentang putus mahkamah agung sifat binding ikat,0
592,naik iur serta bpjs sehat pandemik bijak pro rakyat patut kritik partai dukung bijak presiden jadi tolok ukur pimpin pdip musim pilih,0
593,klo pake bpjs lu bs pake prudensial asuransi sehat bebas knp lu bego sih,0
594,sih bpjs gotong royong ngobati orang gk bayar sehat gk bayar bpjs urun sehat jd seeetttttruukkkk gara bayar bpjs,0
595,serta bpjs sehat dukung juang fraksi pks orang dungu salam akal sehat,0
596,ngatain bego lu jg goblok program kluarga lu pikir bpjs sampe program gratis biaya sehat lu pikir mikir,0
597,laaah ambil untung dasar bego kayak pake asuransi sehat tinggal bpjs mahal mending alih aj mandiri in health uang sehat pakai asuransi mandiri in health layan,0
598,ruar khalifah umar rakyat beban naik bpjs sehat,0
599,naik bpjs sehat bikin jokowi dlm bahaya impeachment mata moga tdk tambah derita rakyat,0
600,bijak naik iur bpjs sehat jokowi mendapata sorot walikota solo anggap jokowi sengsara rakyat,0
601,naik langsung operasional bpjs sehat bajing dana operasional bpjs sehat,0
602,bpjs sehat utang jatuh tempo triliun rumah sakit,0
603,tdk butuh pikir modern butuh pikir awam contoh bpjs dah bantu sehat perintah suruh bayar emang jual bpjs jual gandeng pertamina bpjs plus premium,0
604,gagal jalan amanat uud uud tsb adlh lindung segenap tumpah darah indonesia,0
605,waras si jolowi nggak mikir rakyat krn indonesia,0
606,naik bpjs sehat jokowi nilai sengsara rakyat,0
607,tanda negara uang bpjs sehat naik lawan hukum ma sejahtera rakyat peras pandemi covid tuk makan hari sulit,0
608,sehat sakit bayar iur sehat cebong tuju naik iur bpjs hati ngamuk tetep hore ada sesal salah pilih bong,0
609,ngotot naik iur bpjs sehat presiden jokowi tonton tabiat puji,0
610,iur dirut bpjs sehat bela si nganu tuuuh dirut bpjs bela rakyat apes bgt rakyat indonesia,0
611,bubar bpjs sehat argumentasi alas bpjs sehat bukti sah,0
612,bayar bpjs sehat empot empot sampe nunggak suruh nyicil rumah tua hadeh ngape coba dasar anjing,0
613,tdk pnh blg tolak bpjs inti diskusi adlh kpd pres tdk tentang subtansi ada bpjs fungsi masyarakat bwh akses sehat pada spt pasien asuransi premium,0
614,prank uni kala suka iur bpjs sehat batal naik kuat hukum bayar bpjs sehat buruh kena phk penuh butuh hidup bpjs sehat anggota dasar rezim babi makan sampah,0
615,bubarin aje bpjs sehat kembali uang rakyat,0
616,pimpin hati harus sehat rakyat tanggung negara prnimpin bilang khulafaur rasyidiin naik bpjs rakyat susah zholiim,0
617,hahahaha impeachment jokowi gara bpjs sehat patut duga curiga prosesor hukum pakde jujur pilih jokowi capres kemarin harap kabinet menteri periode eh periode menteri,0
618,pilih bubar bpjs sehat indonesia bubar,0
619,klo kpingin cepet turun tenaga sehat mogok kerja klo bbm ama bpjs turun,0
620,pimpin nurani rakyat puruk dlm hadap wabah virus corona iur bpjs sehat naik pikir ringan beban rkytnya saat situasi spt ambil putus sengsara rakyat,0
621,dilam bpjs sehat warga negara wajib milik bpjs sehat sdh daftar henti anggota kecuali tinggal mati turun dana zolim dasar,0
622,harap sakit parah sih kek biaya sehat segitunya opname habis segitu jg asuransi dr kampus bayar pake ukt make bpjs,0
623,dlu bpjs harap sehat masyrakat tdk sungguh ironis,0
624,kondisi sulit alas naik iur bpjs sehat pura bodoh bodoh beneren,0
625,tambah atur telat mbayar kena denda ogah bayar gratis biaya sehat perintah dn bpjs berzifat sosial gotong royong sifat pajak dn bentuk asuransi sehat jd dampak sakit,0
626,rakyat indonesia ikut bpjs ken ikut program gotong royong bidang sehat skrg asa jebak cm bs henti tinggal g ngelapor tinggal ttp kena tagih lg hts bayarin kk saudara pd g gila,0
627,wow bodoh banget nggak makan berita bpjs sehat ketenagakerjaan,0
628,tuju sby bpjs gotong royong bidang sehat nominal tdk berat serta jokowi bpjs jadi alat peras rakyat,0
629,info psbb cicil minggu total bulan sampe tugas sehat baper turun derajat hastagnya info bpjs kerap php nek turun kek viralnya influencer otak tinggal truslah karya bodoh yah,0
630,bodoh tetap hukum mahkamah agung cuek naik tarif bpjs sehat lanjut buruk susul tunggu buruk muncul kah jengah,0
631,bpjs jamin sehat tanggung negara defisit negara nanggung sekitar istana project prank kerja genah bpjs uang tolol banged sik dibodohin mulu ama rezim,0
632,wajib entah salah satu jamin sehat jelata beban naik bpjs beban gotong royong jelata suruh bayar pajak baca buku john perkins biar kmn pergi pajak negara brkmbang,0
633,alah gotong royong sehat kampung bentuk republik bpjs,0
634,sehat masak beli rokok bpjs sehat bungkus rokok ngeluh rangin jatah rokok,1
635,baca mana bpjs sehat klas tdk naik jokowi jokowi ttd berkas ngak baca baca ngak dukung jokowi malu in,1
636,wakil enak rakyat bagi wakil susah tau tau banget wakil umat bpjs sehat listrik api air pupuk dsb tanggung rakyat sebut hidup mandiri,1
637,bpjs sehat pribadi pikir rakyat rakyat bayar hasil turut rekan kerja pikir naik tarif jokowi,1
638,jokowi tekan pres 2020 ttg ubah pres 2018 ttg jamin sehat naik iur bpjs sehat batal ma naik presiden dmn nurani pimpin membebanirakyat,0
639,naik iur muncul bpjs bukti lepas tangan perintah tanggung layan sehat rakyat,0
640,bijak naik iur badan selenggara jamin sosial sehat bpjs sehat sehat nilai blunder anggap turun pamor presiden joko widodo,0
641,iur bpjs sehat naik sembunyi mana otak perintah,0
642,hahahaha dah injak ngelawan usaha sdh nanggung bpjs sehat bpjs tenaga kerja pajak hasil tambah lg tapera,0
643,bubar bpjs sistem urus sehat masyarakat urus pemda,0
644,din naik iur bpjs sehat tambah susah rakyat,0
645,naik iur bpjs sehat pandemi zalim,0
646,bpjs sehat jokowi sikap arogan,0
647,sih brfikir jokowi curiga hati drpd prakerja mending anggar nutup bpjs sehat,0
648,nunggak hutang beda bahasa ajah nunggak iur bpjs bayar papa pokok enam discroll twits jelas situ bijak iur bpjs sehat pandemi,0
649,intermezzo bahas contoh lawan komunis kelas bpjs mreka juang kelas sosial bayar sekian smua dapet laku sehat,0
650,mending klo ekonomi sehat ekonomi mblangsak bukti selisih harga bbm embat bpjs nyekik leher,0
651,bpk naif dukung scr babi buta lach naik iur bpjs sehat,0
652,naik iur bpjs menandakakan ketidakmampuan negara tangan pembiayaaan sehat warga negarannya,0
653,partai loo ngapain senayan ngocok iur bpjs sehat wabah corona ahy jatuh timpa tangga,0
654,alih bantu rakyat beban rakyat bilang naik dlm kondisi krisis spt skrg beban rakyat,0
655,bikin jokowi takut umat islam murka rakyat marah,0
656,covid tdk hilang dr bumi hrs buat umat manusia duduk bumi perintah jngn naik bpjs sehat rakyat dlm kondisi sulit jngn beban masyrkt,0
657,jalan program bpjs mudah hadap lawan usaha farmasi rumah sakit swasta asuransi sehat satu dokter mikirin orang ekonomi lemah indonesia emang pakai bpjs,0
658,nyinyir pake asuransi sehat swasta tau pake asuransi swasta kena limit premi banget beda bpjs skrg pasang ring jantung mrk coba gk pake bpjs wani pasang,0
659,jatuh timpa iur bpjs sehat,0
660,stop bayar bpjs bpjs hak sehat rakyat hutang upeti kuasa cair kembali uang umpama hidup rakyat tdk bpjs,0
661,serta mandiri enak tinggal bayar selisih serta pbi tinggal regulasi surat penuh lapor dinas sehat perintah dinkes bayar selisih bpjs,0
662,potong wajib bpjs sehat potong duit diinvest negara iya klo cuan klo kayaak jiwasraya gmane bos modal kagak buntung iya krain dapet program rumah dpet surat utang negara lot otak malesin ni org,0
663,rs curangin bpjs paket biaya sodor standar rs paksa terima organisasi profesi sehat ajak buat paket tsb nol,0
664,menteri bilang sanggup bayar iur bpjs sila turun kelas komentar sanggup urus sehat rakyat sila turun jabat menteri cuman makan gaji buta,0
665,goblok borong om presiden sdh taat bpjs sdh turun lha tau bpjs turun asuransi sehat non bpjs itu bayar negara malu kmu zon,0
666,dana bpjs tdk ratus persen sehat direksi tdk transparan tdk audit kerja bpjs bpjs defisit,0
667,coba lihat sudut pandang bpjs rakyat penuh jamin sehat rakyat tahan makan naik bbm diturunin inflasi begimane wkwk krismon,0
668,virus corona hantu hidup rakyat indonesia hantu tambah iur bpjs sehat subsidi elpiji kg cabut jual beli online kena pajak puluh persen emang negara bangsat penuh rezim otak,0
669,buka lowong bpjs sehat batal rekrut buzzer nasib negara presiden jokowi koclak lembaga an,0
670,jokowi tepat janji jurus ketemu tri sehat naik iyuran bpjs pirsa harap sabar otak belah,0
671,gitu kronologi anggar sehat triliun knp iur bpjs,0
672,presiden bilang bpjs sehat defisit salah kelola solusi naikin gaji direksi iur serta ambyar,0
673,masyarakat timbang hapus eh laku gila,0
674,cari jalan peras rakyat legal batal ma buat pres jokowi kali naik iur bpjs sehat rezim bangsat,0
675,bpjs ganti nama badan iur rakyat berita ngomong sehat,0
676,bpjs sehat mengcover orang sakit orang goblok,0
677,bpjs karna rayu presiden menang pilpres wilayah mantera menteri tanggung tunjuk ksatria presiden tulus junjung uud sejahtera rakyat bidang sehat pidana,0
678,beda kelas sby bpjs peduli jkw bpjs beban sby bpjs solusi sehat jkw bpjs putus ma jalan,0
679,sesuai besar iur bpjs sehat langsung layan sehat rakyat korban kapitalis harus bantu kapitalis,0
680,cucok nih blacklist bpjs nakes alkes fasilitas sehat etapi reak negara diskriminatif hadeeuuuhhhhh rese beud yaaa,0
681,iur bpjs sehat paksa gotong royong,0
682,jokowi tekan pres ttg ubah pres ttg jamin sehat naik iur bpjs sehat batal ma naik presiden dmn nurani pimpin membebanirakyat,4
