,words,cluster
574,prinsip bpjs sehat gotong royong tolong naik iur tolong tingkat faslititas bpjs sehat iur bpjs,0
575,bain bpjs jaring kam sosial bidang sehat,0
576,sanggup bayar bpjs bpjs pola hidup sehat doa allah swt senantiasa sehat biar kluar uang obat elu trs medsos klo sanggup renti gitu repot,0
577,nambahin tips nego gaji make sure tanggung beban pph bpjs tapera miss pas nego eh gilir gaji potong macem patok angka inget nama benefit jd jarak kantor deket kerja jamin sehat,0
578,jg serta bpjs sehat jkn kis tunggak longgar lunas loh tenang yaaa status serta aktif bayar prinsip gotong royong tolong,0
579,bpjs bantu masyarakat azas gotong royong jd panik krn salah satu jaga sehat,0
580,pokok paham ajah prinsip iur bpjs susah doyan boba coba anggar boba bayar bpjs sehat sisa yuk gotong royong tolong tolong rajin bayar iur,0
581,prinsip bpjs gotong royong tolong pandemi butuh bantu sehat iur bpjs,0
582,sepakat pikir serta bpjs kelas alhamdulillah kasih sehat jd biar butuh manfaat senang gotong royong bantu butuh,0
583,guys skrg paham bpjs asuransi sehat jamin sehat perintah rakyat bpjs istilah gotong royong tolong tolong inti rakyat bayar premi,0
584,new normal masker jaga jarak cuci tangan bpjs sehat gotong royong,0
585,bpjs sehat cair dana bpjs sehat sifat gotong royong iur bayar manfaat serta butuh manfaat layan,0
586,presiden indonesia bp ir soekarno pondasi bangsa kuat adlah gotong royong nilai hakiki jiwa hati sanubari diri republik bpjs adlah gotong royong manusia sehat,0
587,iya bpjs sehat program gotong royong kurang tanggung apbn,0
588,bpjs gotong royong bikin rekening gotong royong bank tanzania puluh juta nyambung bpjs makan restaurant dana bpjs struck bayar dana kumpul sehat rakyat miskin facilitates kelas rakyat,0
589,psbb selesai nongkrong disiplin jaga sehat gotong royong tolong,0
590,temen temen naik bpjs lanjut layan bpjs inti gotong royong tolong,0
591,naik iur bpjs lanjut gotong royong tolong,0
592,masyarakat sadar dlm bayar iur jgn jarang sakit bayar iur bpjs sehat sifat gotong royong sehat batu sakit gitu om mardani ali sera jgn nyalahin perintah,0
593,new normal bareng babeh jek bedul terap disiplin masker jaga jarak cuci tangan bawa hand sanitizer yaa gotong royong tolong bpjs sehat layan baik masyarakat,0
594,yuk jaga jarak gotong royong tolong lupa pakai masker cuci tangan sabun air alir,0
595,terap new normal jaga jarak aman cuci tangan lindung lupa pakai masker gotong royong tolong moga normal,0
596,salah prinsip bpjs sehat adlh gotong royong allhamdulillah bpjs sehat kis adik sy selmt setlh operasi tumor otak kali operasi kepala terima kasih tuk negara bayar bpjs indonesia smoga sellu sehat damai indonesia ku,0
597,new normal taat protokol pakai masker jaga jarak aman habis darimana cuci tangan tangan bersih gotong royong tolong,0
598,gerombol sumbu pendek mental gratis dungu paham ttg sehat negara gotong royong kunci klo bayar bs bantu perintah gerombol sumbu pndek nyampe arah tau bpjs teriak,0
599,prinsip bpjs sehat gotong royong tolong negara bantu bayar iur jkn juta plus pres subsidi,0
600,bpjs seprti udunan atw gotong royong bangun ego mkr kls tpi mrk mmpu biaya kamar rumah sakit vip kls ttp miris keadaanya hindar praktek busuk dlm sehat,0
601,nilai skema iur bpjs sehat baru atur presiden kelompok skema iur baik serta watak gotong royong adil,0
602,direksi bpjs papar terang video mana bpjs landas sistem gotong royong bantu nikmat layan sehat,0
603,ukur utama bhw pimpin tdk peduli rakyat krn bijak naik iur bpjs nota bene layan layan sehat rata sistim gotong royong,0
604,banget konsep gotong royong wajib warga negara indonesia milik bpjs sehat tmsk wajib usaha ikut karyawannya bpjs sehat bpjs sehat usaha asuransi sehat,0
605,bpjs sehat layan guna bpjs buruk periksa puskesmas keluh kasih obat paracetamol vitamin konstruksi dasar gotong royong,0
606,juta jiwa biaya perintah system gotong royong mudah,0
607,prinsip bpjs sehat gotong royong bumn swasta iur sepakat stakeholder serta,0
608,masyarakat ramai ramai tolak keras naik iur bpjs sehat coba lmbaga polling rs mrk tuju or tdk papar hasil pollingnya media bpjs org sakit shat jaga keshatan bantu sakit gotong royong,0
609,program bpjs uang negara mengcover butuh sehat warga bikin system gotong royong kayak bpjs benar mana yah gaji ajah inflasi masak iur bpjs,0
610,peran bpjs sehat rasa atur pres 2020 tetap iur bpjs dukung patuh atur,0
611,gin jelas serta kelas pbpu bp bayar iur bpjs puluh ribu orang alias kelas bpjs sehat,0
612,bilang bpjs sehat php perintah php perintah pikir rakyat no no no nyata perintah bpjs peduli,0
613,dukung bpjs sehat pandemi longgar status serta aktif pandemi tunggak bayar enam sisa uang beli takjil mending bayar iur bpjs biar engga berat,0
614,bpjs sehat bantu keluarga rasa manfaat bpjs sehat obat mertua kena stroke gratis rawat jalan fisiotherapy rawat inap operasi obat cek darah gratis bayar iur kls sj,0
615,iur bpjs sehat kelas kelas gratis gratis teriak iur bpjs sulit orang miskin orang bagi orang miskin lindung balik orang miskin,0
616,tahu guys bpjs naik iur jalan maksimal layan sehat aman tau bpjs defisit parah iuranbpjs,0
617,rawat inap semalama tujuh enam malam gara sakit lambung vertigo akut rawat jalan obat gratis bpjs sehat kelas bayar iur kali rasa manfaat,0
618,masya allah moga perintah mampu tuk bantu rakyat layan sehat iur bpjs tuk kelas krn subsidi,0
619,prinsip gotong royong tolong lapis masyarakat layan sehat bpjs iur bpjs,0
620,sulit kerja terima upah ppu daftar kolektif usaha kantor bpjs sehat dekat urus tinggal berkas hrd tau tau kartu serta dah iur bpjs,0
621,naik iur langsung bpjs sehat iur bpjs,0
622,sih kaget yah turut sih gpp biaa tingkat fasilitas bpjs sehat,0
623,konsul langsung kantor bpjs sehat ajah layan lupa pakai masker tes suhu gantung kantor bpjs sehat sih tutup,0
624,moga putus perintah naik iur bpjs manfaat senantiasa sehat aamiin yra,0
625,teman tdk alami sulit ekonomi pliss jgn telat bayar iur bpjs sehat support mndukung lancar bpjs sehat,0
626,langsung bpjs salah ladang amal bantu lemah,0
627,iur bpjs kumpul sepenuh cukup biaya program ambil sesuai besar tarif iur bpjs sehat tingkat kualitas,0
628,naik iur bpjs sehat harap baik layan sehat idi nilai sulit bayar fasilitas sehat,0
629,lembaga jamin sehat sesuai tingkat ekonomi masyarakat bpjs khusus tengah bawah rumah sakit rumah sakit rujuk single tarif masuk akal hehe,0
630,naik iur bpjs berat serta perintah sigap hadir subsidi,0
631,iur percaya berat serta bijak bareng putus mudah win win solution,0
632,naik iur bpjs berat serta negara hadir bantu bpjs terima kasih perintah perintah subsidi bpjs serta bpjs sehat,0
633,teriak naik iur bpjs sehat paham kelas kelas subsidi perintah,0
634,naik iur bpjs jamin stabilitas uang jaga lanjut bpjs,0
635,salah kaprah naik iur bpjs sehat berat serta support bpjs sehat layan baik,0
636,naik iur bpjs sehat tingkat kualitas layan sehat masyarakat bukti masyarakat,0
637,iur bpjs gotong royong kelas tengah tas bantu kelas masyarajat sehat,0
638,iurang bpjs gotong royong bantu kuat sulit bantu layan sehat keluarga bahagia,0
639,salah nilai naik iur bpjs berat serta krn kelas perintah subsidi bpjs,0
640,naik bpjs jaga jamin sehat nasional bpjs jaga bantu masyarakat,0
641,iur bpjs sehat alas gotong royong baik,0
642,gotong royong tolong naik iur bpjs sehat berat tuk serta smga masyarakat tolong,0
643,dapat naik iur bpjs berat tuk serta orang data mari doa baik gotong royong tolong,0
644,sektor kerja tingkat tambal defisit usaha daftar pegawai program bpjs sehat,0
645,gk keleeess mending bpjs murah riah ambil kelas murah banding asuransi sehat,0
646,sesuai besar iur bpjs sehat langsung layan rakyat,0
647,sy lho mas bpjs jamin sehat keluarga apa kelas oenting obat kl sulit bayar bpjs coba aju pbi biar biaya dibayarin perintah mekanisme dpt surat dr desa trus bawa dinsos,0
648,mampu pilih bayar iur kondisi program sehat iur pakai tolong sakit,0
649,coba masyarakat dewasa pikir mantan dpr gagal tukang nyinyir didenger bpjs bantu masyarakat tengah atas ekonomi plg ribut kls gpp jokowi hancur mafia sehat jg,0
650,bantu sehat bantu sakit bpjs butuh layan sehat sehat bilang bpjs haram,0
651,riya sehat bayar bpjs kelas nyiyir beli kouta internet bulan ratus ribu maaf dar contoh,0
652,salah satu faktor moga naik iur bpjs tingkat layan sehat masyarakat,0
653,knp rakyat beban naik iur kelas salah kelola bpjsnya turun kelas solusi protes lindung balik miskin hak rakyat layan sehat dri uang mrk kelola bpjs,0
654,mertua pake bpjs oprasi tiroid sampe ablasi kontrol sampe skg krn hrs ablasi kali oprasi katarak ayah mertua msh rutin kontrol minum obat krn stroke bayang gimana bayar klo pake bpjs sehat,0
655,salam sehat dm terima interaksi dm terima kasih gs,0
656,bpjs sehat gera gotong royong cegah tenaga sehat kena corona metrotimes news jackylatuhihin,0
657,lupa ikut lomba rally vlog sehat ala tantang minggu tema tips makan sehat info cek link bpjskesehatan iuranbpjs,0
658,bpjs sehat sebut naik iur dasar pres nomor penuh aspirasi masyarakat gabung komisi ix dpr ri,0
659,masyarakat peluang menang sprti dlm gugat masyarakat pasal pres mahkamah agung ma masyarakat hasil batal bijak perintah naik tarif bpjs sehat kelas iii rezimparanoid,0
660,perintah pusat ambil alih tanggung iur serta badan selenggara jamin sosial bpjs sehat kategori terima bantu iur pbi juli perintah,0
661,tau bpjs sehat ada lomba rally vlog sehat ala tantang minggu tips makan sehat ikut yuk sumber,0
662,dirut bpjs presiden jokowi hormat putus ma ubah iur bpjs sehat bpjskesehatan iuranbpkskesehatan jokowi fahmiidris,0
663,teman teman lomba seru nih bpjs sehat ada lomba rally vlog sehat ala tantang minggu tips makan sehat info lengkap teman teman klik link yuk gegas,0
664,bpjskesehatan ada lomba rally vlog sehat ala tantang minggu tips makan sehat,0
665,iur sehat org y jk mmg tdk mgunakannya n sbg syukur kasih sehat jujur sy tdk bpjs,0
666,rapat yuk bpjs sehat ada lomba rally vlog sehat ala cek link bawah,0
667,bayang klu ngga bpjs sehat bingung bayar biaya rmh sakit smua mmg plus n minus klu sdh pikir mslh sehat rasa keluar duit ribu bknlah berat,0
668,ppp rakyat peluang menang gugat naik bpjs sehat,0
669,bpjs sehat jaga kualitas sinambung program jamin sehat bpjskesehatan bpjsnaiklagi covid,0
670,atur presiden naik bpjs sesuai aspirasi masyarakat bpjskesehatan bersamalawancorona,0
671,fraksi pan pks partai demokrat dpr kamis perintah batal naik iur bpjs sehat tepat batal pres no,0
672,naik iur bpjs sehat jaga lanjut program jamin sehat nasional jkn,0
673,bpjs sehat bebas denda tunggak iur,0
674,istana naik iur bpjs sehat hitung mampu bayar masyarakat,0
675,agusyudhoyono naik iur bpjs sehat tingkat layan fasilitas sehat moga faham,0
676,bpjs butuh gotong royong tahan eksistensi layan sehat masyarakat naik iur serta kelas efektif subsidi iur berat pindah kelas,0
677,perintah ngambil bijak naik iuranbpjs sesuai iur bpjskesehatan cantum pres no subsidi perintah serta pbpukelas iii periode juli desember,0
678,menteri koordinator bidang ekonomi airlangga hartarto putus naik iur jamin sehat nasional kartu indonesia sehat jkn kis jaga lanjut bpjs sehat,0
679,kepala biro humas mahkamah agung ma abdullah langkah perintah naik iur bpjs sehat atur presiden nomor,0
680,naik iur bpjs tuju jaga kualitas sinambung program jamin sehat bijak dana jamin sehat iur sinergi bijak uang negara proposional,0
681,serta bpjs sehat kelas iii subsidi perintah,0
682,negara hadir sesuai iur bpjs sehat yuk simak jelas,0
683,covid tunggak iur bayar max tunggak pres sesuai jalan perintah ma,0
684,bpjs sehat upaya layan baik masyaraka,0
