,words,cluster
309,bijaksana bpjs sehat pandemi covid tunggak iur bpjs bayar maksimal enam tunggak bantu banget ringan serta bpjs kena dampak,0
310,pandemik covid orang kena dampak perintah bpjs sehat diam cari jalan baik masyarakat salah satu bijak longgar bayar iur,0
311,peran bpjs sehat rasa atur tetap iur bpjs dukung patuh atur,0
312,kabar baik serta jkn kis tunggak iur bpjs longgar lunas status serta bpjs sehat aktif,0
313,iya gapapa iur bpjs sehat krn mmg harga sehat orang konsumtif beli barang online beli nmn harga sehat wabah covid tata ulang prioritas hidup konsumtif tetap bijaksana,0
314,bpjs sehat upaya layan baik masyarakat,0
315,sesuai besar iur bpjs sehat langsung layan sehat rakyat,1
316,bpjs sehat layan sesuai besar iur bpjs sehat,0
317,kaget sesuai iur bpjs kali tenang negara hadir sesuai iur bpjs sehat,0
318,jamin sehat nasional asuransi sosial prinsip gotong royong kaya nolong miskin sehat nolong sakit bpjs asuransi komersil provokasi narasi perintah peka perintah hadir rakyat sakit,0
319,sesuai besar iur bpjs sehat langsung layan sehat rakyat bayang pagebluk masyarakat paham jaga negara,0
320,kaget sih dengar iur bpjs juli gimana sakit mahal harga abai sehat,0
321,video jelas bukti hadir perintah sesuai iur bpjs sehat pres enam puluh ribu puluh,0
322,syukur sehat kali bantu krn ada bpjs tolong bayar bpjs bayar bpjs ikhlas moga bantu orang butuh moga kelola bpjs manfaat,0
323,nilai bantu misi negara bantu orang miskin akses layan sehat tarif bpjs murah dunia tdk bantu negara jebol apbn,0
324,pro logika aja asuransi sehat cover premi serendah biar provider gantiin bpjs dinaikin bubar bpjs bpjs bubar mudarat,0
325,perintah ngambil bijak naik iur bpjs sesuai iur bpjs sehat cantum pres no enam ribu puluh subsidi perintah serta pbpu kelas,0
326,pikir biaya sehat biaya murah sakit biaya dokter biaya obat asuransi swasta mahal bpjs manfaat sakit tolong org subsidi silang pahala beda swasta subsidi silang,0
327,inti komunikasi perintah buruk rakyat nggak berat tolong manfaat pegawai kena naik potong bpjs nggak pakai bpjs asuransi sehat,0
328,sehat masak beli rokok bpjs sehat bungkus rokok ngeluh rangin jatah rokok,0
329,tuju naik nominal naik istimewa coba pikir org hasil umk terima upah keluarga 4 org bpjs sehat kelas,0
330,naik iur bpjs sehat jaga lanjut program jamin sehat nasional jkn masyarakat rasa manfaat,0
331,naik iur langsung bpjs sehat masyarakat manfaat,0
332,bayang ngga bpjs sehat bingung bayar biaya rmh sakit plus minus sdh pikir sehat rasa keluar duit ratus puluh ribu ribu berat,0
333,baik masyarakat luas program bpjs prinsip gotong royong untung rugi sehat sehat syukur uang setor manfaat saudara saudara kena sakit,0
334,iya bpjs sehat ikhlas jalan program,0
335,naik langsung operasional bpjs sehat bantu masyarakat butuh,0
336,berat naik bpjs org kerja langsung bantu org butuh tolong sehat situ,0
337,gotong royong tolong cinta bpjs sehat,0
338,bagus niat bantu saudara tanah air biar manfaat fasilitas sehat sedia bpjs,0
339,lanjut layan bpjs sehat iur naik moga maklum,0
340,subsidi silang bayang bpjs jalan uang orang ri layan sehat bpjs sdh kacau balau rs tolak pasien rs blm bayar bpjs,0
341,banget manfaat bpjs hilang masyarakat gol dpt akses sehat,0
342,wow iur bpjs sehat juta warga tanggung pemprov aceh,0
343,guna dana bpjs sehat jaga orang takut obat rs setor bpjs wajib bayar,0
344,ebook pandu layan serta jamin sehat kali ken tau jelas gamblang nih perintah bantu iur serta bpjs sehat,0
345,manteman info nih e book pandu layan serta jamin sehat kali ken tau jelas gamblang perintah bantu iur serta bpjs sehat,0
346,bagus nih pandu serta jamin sehat,0
347,bpjs sehat masalah turun kelas serta,0
348,betapa ebook muda mud paham pandu layan serta jamin sehat lengkap ulas,0
349,bingung pandu layan sehat bpjs galau gundah gulana coba download nih e booknya lengkap bgt deh,0
350,layan baik masyarakat sedia ebook pandu layan sehat serta jamin sehat pandu link,0
351,salah layan bpjs sehat masyarakat buta tahu layan jamin sehat nih download pandu layan guys,0
352,harap hadir ebook pandu serta jamin sehat bantu masyarakat layan baik bpjs sehat,0
353,hak wajib serta ulas ebook pandu layan serta jamin sehat yuk coba ajar layan bpjs sehat puas masyarakat,0
354,gotong royong tolong lho ebook pandu layan masyarakat lengkap banget 136 halaman lho,0
355,layan bpjs sehat puasa masyarakat bpjs sehat usaha layan baik masyarakat indonesia,0
356,info pati maksimal layan bpjs pati luncur aplikasi antre online obat reporter cholis anwar mei murianews upaya mudah pasien jamin sehat,0
357,prinsip gotong royong tolong bpjs sehat paham luang baca ebook pandu layan serta jamin sehat,0
358,bingung layan bpjs sehat suka bingung layan sehat jamin amp gk jamin trus e book pandu layan bpjs sehat bikin paham ttg bpjs,0
359,ebook pandu layan serta jamin sehat baca baca tu mata bpjs sehat layan masyarakat,0
360,makan hoaks bpjs sehat mending baca ebook pandu layan serta jamin sehat deh komplit,0
361,yuk unduh ebook pandu layan serta bpjs sehat biar paham tata alur mekanisme gotong royong tolong,0
362,kantor bpjs sehat blora selatan medan blora utara jalan rusak tembus hutan lebat biar susah,0
363,kartu bpjs sehat gin banget jaga sehat jangka manfaat banget loh nih ebook pandu disave,0
364,serta jamin sehat nasional ebook pandu layan serta jamin sehat loh,0
365,manfaat ebook pandu layan serta sehat mari simak,0
366,download yuk ebook pandu layan serta jamin sehat paham prosedur laku tau layan,0
367,serta binggung ttg layan sehat bpjs serta baca ebook pandu layan sehat,0
368,siang guys yukk cuss download ebook pandu layan serta jamin sehat bsa paham bsa memanfaatkanny cekidot,0
369,ebook pandu layan serta jamin sehat ebook format pdf manfaat ebook,0
370,teman teman ebook pandu layan serta jamin sehat baik masyarakat,0
371,new normal g coba unduh pandu sehat bpjskesehatanri biar ready manfaat bpjs sehat,0
372,bpjs sehat konsisten layan mekanisme syarat tentu,0
373,sakit jamin sehat tenang kisah pasien hemodialisis syukur program jkn kis baca lengkap,0
374,wacana bpjs potong pajak hasil tuju dinda jamin sosial sehat bayar hasil pajak warga riset teman arah situ,0
375,milik dua lupa maha kuasa bpjs sehat,0
376,dokter ugd igd emergency gawat darurat jamin bpjs sehat ranah medis wenang dokter tanggung pasien,0
377,periksa dokter ugd igd nyata dokter emergency gawat darurat jamin bpjs sehat rujuk faskes tingkat i,0
378,pasien hemodialisa aku bantu serta jkn kis,0
379,pasien hemodialisa aku bantu serta jkn kis republika online,0
380,bpjs sehat sederhana aju klaim pasien covid syarat mudah,0
381,bpjs sehat layan optimal sesuai protokol covid,0
382,terima kasih moga sehat,0
383,atur perintah kait bpjs sehat ri bpjs sehat bantu maju bpjs sehat jg loh,0
384,naik tarif iur bpjs opsi sulit tpi langsung bpjs sehat tetep layan kelas sdh dapaf subsidi perintah subsidi bpjs negara hadir bantu bpjs new normal,0
385,sih bpjs tutup bikin susah rakyat sesuai tarif bpjs layan bpjs sehat iur bpjs new normal negara hadir bantu bpjs perintah subsidi bpjs,0
386,naik tarif jd debat mmg bantu operasional bpjs jalan skr solusi serta mandiri kelas bpjs sehat new normal iur bpjs negara hadir bantu bpjs perintah subsidi bpjs,0
387,bpjs sehat selamat layan masyarakat mari dukung perintah iur serta bpjs sehat,0
388,sebentar newnormal lanjut bpjs sehat baik moga temu jalan baik gotong royong tolong,0
389,liat ilustrasi cerita bpjs sehat biar mudah erti moga bpjs sehat baik depan,0
390,ragu deh klo bpjs sehat hapus baik plus minus lahir cesar rs pakai kartu bpjs sehat layan baik masyarakat,0
391,pen ngakak liat cerita si jono pas sakit banyak mikir tinggal pergi pusat sehat pake kartu bpjs gampang biar cepat sembuh,0
392,perintah bantu iur serta bpjs sehat gotong royong tolong baik,0
393,gimana bpjs sehat mending hapus baik apa hasil moga bpjs sehat layan baik,0
394,kakak doa kartu kepake bpjs niat biar bantu lbh orang sakit beban lbh gede msh sakit mikirin biaya moga sll sehat,0
395,jg baik masyarakat luas om ellys kerhi program bpjs prinsip gotong royong bkn untung rugi sehat sehat syukur uang setor manfaat saudara kena sakit salut,0
396,iyak bpjs sehat jg ikhlas,0
397,bpjs sehat aku bahas hapus kelas mandiri satu dua kelas standar manajemen bpjs sehat isyarat dukung jalan amanat atur presiden jamin sehat,0
398,bpjs sehat butuh dukung jalan peran fungsi,0
399,perintah bantu iur bpjs sehat mmbrikan pelaynan masyrkt mari support bpjs sehat layan baik,0
400,penejelasannya pake cerita gambar erti moga bpjs sehat baik,0
401,paham yuks dukung apa putus moga layan,0
402,poinya kartun ambar serta puas layan bpjs sehat depan bpjs sehat mending hapus baik baik sih,0
403,baik kak bpjs sehat bantu proses lahir,0
404,perintah usaha bantu masyarakat layan sehat baik moga cerah masyarakat indonesia lupa bayar iur,0
405,makan biar mikirnya bener bpjs sehat terima kasih bpjs nagara bantu bpjs,0
406,sepakat mba negara maju gotong royong,0
407,bpjs sehat dipwrbaiki hapus,0
408,ngerti iur kelas 3 lho aman berat,0
409,lanjut baca n paham,0
410,ngeh informasi banget teliti,0
411,komik syarat informasi banget ngeluh gitu,0
412,pasti mba mending baik drpd hapus kasi bener butuh,0
413,bingung iur pbi aman puyeng periksa biar sehat bugar,0
414,kali dangkal informasi riuh yuk baca biar paham,0
415,moga baik bpjs sehat,0
416,paham kelas subsidi perintah yuk cari tau biar info lengkap simpang siur makan hoax lengkap cek komik ok,0
417,eh iya komik bagus banget kemaren kemaren bingung iur bpjs bilang mending bpjs hapus coba mending hapus baik hayooo,0
418,baca sampe abis yah komik suer nih komikus keren banget kisah putar,0
419,bpjs tenaga kerja faham orang perlu bpjs sehat hasil kecewa,0
420,indonesia kenal gotong royong bantu,0
421,mal aidin walfaidzin mohon maaf lahir batin share cerita putar mending baik hapus,0
422,naik iur bpjs kelas tuju perintah gotong royong tolong orang kaya bantu orang miskin insyaallah berkah anak cucu amin,0
423,bpjs mending hapus baik sih hapus rasa manfaat obat kartu bpjs sehat rumah sakit,0
424,perintah atur tuju benah depan layan terima masyarakat bagus lanjut,0
425,mending baik masyarakat puas layan bpjs sehat rasa manfaat masyarakat miskin banyk bantu,0
426,lanjut bpjs penting azas manfaat terima dukung lanjut bpjs sehat,0
427,pribadi pilih bpjs sehat baik prinsip gotong royong tolong dalam baca deh jelas gambar,0
428,naik iur bpjs kelas atur beban rakyat miskin jutru luas lindung,0
429,yakin lanjut bpjs baik pilih bpjskesehatan baik kudu sosialisasi peran negara hadir bantu bpjs perintah subsidi bpjs biar salah paham,0
430,paham sih mending baik perintah bantu iur serta bpjs sehat lampir foto ekonomi tolong bantu,0
431,alhamdulillah bpjs sehat,2
432,pilih hapus mikir jangka sakit duit perintah bantu iur serta bpjs sehat masyarakat rasa fasilitas sehat,0
433,perintah naik iur bpjs sehat kelas 1 2 bs tutup biaya gotong royong tolong,0
434,cerah bpjs sehat semangat gotong royong kaya bantu miskin bantu,0
435,man teman inshaallah naik beban mmpu doa perintah baik,0
436,coba cerna paham iur bpjs sehat naik tuju utama tingkat mutu layan masyarakat,0
437,rakyat sakit usaha bangkrut krn pandemi sopo sing bayar pajak bangun manusia sehat didik kuat bidang gampang bayar utang triliun rawat bpjs seksama,0
438,bpjs sehat mending hapus baik klo kta ak sih baik ja solusi aminn semangatt yukk lihat lanjut komik,0
439,naik biaya iur bpjs harap bantu tingkat layan medis maksimal support bpjs sehat layan baik warga sakit,0
440,perintah nerbitin atur iuranbpjs guna benah layan bagus bpjs sehat mending bpjs layan naik tarif hapus operasional nih,0
441,bener banget nih jelas maman perintah terbit atur tujuanya benah layan bpjs sehat bagus lanjut anak cucu,0
442,inti kaya perintah bantu subsidi nikmat fasilitas bpjs sehat harga jangkau,0
443,program hapus baik manfaat rasa orang golong,0
444,bpjs sehat hadir jamin sehat pegang prinsip gotong royong tolong naik iur kelas nambah beban masyarakat miskin,0
445,alangkah baik cari jalan atas masalah tsb,0
446,juweh karna g prediksi kondisi sehat upaya kondisi ttp fit tambah suplemen ekonomi sehat bpjs jalan karna subsidi iur,0
447,bpjs salah opsi masyarakat dlm oleh layan sehat masyarakat kaya biar pilih asuransi dpt layan lbh muas wajib bpjs rs dpt tentu tarif komersil non serta bpjs,0
448,win win solution penting rakyat perintah naik iur bpjs sehat kelas dampak signifikan rakyat laku baik,0
449,ahy sayang naik iur bpjs sehat ahy tanggap naik iur bpjs sehat sayang putus jokowi pandemi covid turut masyarakat butuh fasilitas jamin sehat,0
450,aktif serta bpjs sehat lunas tunggak,0
451,bpjs sehat tiket kereta api via paytren praktis mudah langsung hp untung,0
452,alhamdulillah thl thr gaji tunjang sehat bpjs edi naik tahap timbang sesuai mampu uang daerah,0
453,kelas serta bpjs sehat hapus tanggap anggota komisi dpr ri tuju komisi dpr perintah fasilitas sehat rumah sakit putus hapus kelas serta bpjs sehat,0
454,ketua hari moi krisis covid perintah hemat anggar tunda naik iur bpjs sehat,0
455,naik iur bpjs sehat msh jangkau iur msh rendah manfaat premi dapat bpjs sehat layan masyarakat,0
456,naik iur bpjs banding besar manfaat rasa moga bpjs lanjut lanjut bpjs baik bpjskesehatan terimakasihpemerintah iuranbpjs negarahadirbantubpjs pemerintahsubsidibpjs,0
457,menko airlangga juta warga gratis iur bpjs sehat,0
458,biaya kelas berat pindah kelas subsidi manfaat medis kelas layan bpjs sehat puasa masyarakat bpjskesehatan terimakasihpemerintah iuranbpjs negarahadirbantubpjs pemerintahsubsidibpjs,0
459,manfaat medis kelas beda fisik kamar iur bpjs manfaat medis support bpjs sehat layan baik bpjskesehatan terimakasihpemerintah iuranbpjs negarahadirbantubpjs pemerintahsubsidibpjs,0
460,alas iur bpjs kelas kesehatana sejahtera masyarakat indonesia yuk support bpjs sehat layan baik bpjskesehatan terimakasihpemerintah iuranbpjs negarahadirbantubpjs pemerintahsubsidibpjs,0
461,bayar bpjs rasa manfaat bpjs uang iur bs manfaat orang sakit gotong royong tolong bpjskesehatan terimakasihpemerintah iuranbpjs negarahadirbantubpjs pemerintahsubsidibpjs,0
462,usaha hati dermawan naik iur bpjskesehatan jangkau bpjskesehatan terimakasihpemerintah iuranbpjs negarahadirbantubpjs pemerintahsubsidibpjs,0
463,support bpjs sehat layan baik bayar iur moga bpjs sehat bs trs ringan beban masyakarat indonesia sakit bpjskesehatan terimakasihpemerintah iuranbpjs negarahadirbantubpjs pemerintahsubsidibpjs,0
464,bpjs sehat layan masyarakat moga layan bpjs tingkat masyarakat indonesia rasa manfaat,0
465,moga program baik ikut layan sehat bpjs butuh kalang,0
466,iurang bpjs ringan gudang manfaat terima milik bpjs,0
467,usaha iur bpjs ringan banding manfaat bayar iur ringan,0
468,sih iur bpjs bpjs sehat worth it,0
469,usaha naik bpjs jangkau biaya ringan banding manfaat,0
470,naik iur bpjs sehat perintah tdk sembarang sgt hitung nilai dampak usaha nila positif,0
471,iur bpjs sehat usaha msh jangkau,0
472,gotong royong tolong bantu perintah ngelola memberioan layan baik,0
473,iur bpjs sehat nilai usaha wajar jangkau manfaat layan puas masyarakat,0
474,perintah pasti kalkulasi besar juran bpjs kena usaha masyarakat alhamdulillah putus perintah naik iur bpjs sehat kelas kelas direspon positif usaha,0
475,kalang usaha iur bpjs sehat nilai banding manfaat terima puas dh layan,0
476,galau iuranbpjs sajah,0
477,lansir kalang usaha aku berat putus perintah naik iur bpjs sehat bukti support bpjskehatan layan baik,0
478,serta mandiri kelas selow iuranbpjs bpjskesehatan berat lha bos berat,0
479,usaha iuranbpjs jangkau bagi banding manfaat lantas ribut,0
480,naik iur bpjs harap layan maksimal masyarakat moga maksimal maju https finance detik com moneter d-5020843 iuran-bjps-kesehatan-naik-pengusaha-masih-terjangkau bpjskesehatan terimakasihpemerintah iuranbpjs negarahadirbantubpjs pemerintahsubsidibpjs,0
481,pandemi ngeluh bpjs dinaikin biarin anggap bantu sehat nasional kali lipat ikhlasin protes tunggu pandemi selesai tunggu vaksin,0
482,mas kt obat dokter swasta orang miskin berat coba orang tdk milik biaya arah paskes paskes perintah insha allah obat mas bpjs sehat ada bkn,0
483,naik iur bpjs tuk kelas tuk sinambung layan bpjs kelas krn perintah subsidi terimakasih perintah komit perhati layan sehat maksimal bg warga,0
484,iuranbpjs kelas subsidi lho semangat gotong royong bpjskesehatan jalan layan bangsa,0
485,usaha berat keluh putus perintah naik iur bpjs sehat iur bpjs sehat nilai banding manfaat terima,0
486,bpjs sehat alami defisit uang naik iur pandemi corona nilai layan sehat jalan,0
487,gk aktifin bpjs lost cover polis asuransi sehat pas kemarin sakit pas lgi covid ekonomi turun rasa sehat jaga sehat rekomendasi polis sehat manulife,0
488,manfaat bpjs sehat banding iur,0
489,iur bpjs sehat defisit anggar pilih mudah perintah batal kartu prakerja alih dana triliun tambal bpjs,0
490,situ tugas sehat sok sok an kritis bpjs deh defisit bpjs dampak tugas sehat uang bpjs cair bulan underpaid deal masyarakat dedel pandemi covid,0
491,naik iur bpjs sehat jaga kualitas sinambung jamin sehat selamat bpjs jamin sehat masyarakat,0
492,pas streaming nemu jelas knp perintah naikin tarif bpjs oke bpjs layan baik,0
493,bpjs sehat maju bangsa negara yuk gotong royong bantu,0
494,ramai anggap zholim naik iur kelas pilih kelas paksa pilih berat pindah kelas inti program sifat gotong royong,0
495,ush beribet mas bpjs jamin sosial hitung jgn disamain asuransi lgian sehat emg wajib negara kuq sy blg hrs gratis minimal jgn berat,0
496,bpjs baik sistem laksana awas ngeluh iur iur alami naik doa moga manfaat sadar sehat mahal,0
497,cancer survivor kemo radiasi tindak biaya jamin bpjs sehat tahan hidup thanks god thanks bpjs sehat,0
498,cover biaya sehat bpjs susah banget rujuk parah lgsg igd rs lgsg opname adminnya nanyain pakai bpjs,0
499,insya allah ridho paham naik iur bpjs audit kerja thd bpjs sehat serta rekomendasi auditor sisi objektivitas buka bpjs manfaat,0
500,naik harga iur bpjs bantu org bayar bpjs org dapet nikmat fasilitas sehat perintah paham coba keluh,0
501,knp sih males analisa knp bpjs sehat hr naik iuranya coba baca deh utas prastow tntang bpjs sehat,0
502,klo negara maju ansuransi sehat spt bpjs hitung dapat orang orang klo orang dapat kaya paksa perintah bayar iur pajak klo orang miskin bayar iur pajak,0
503,gk berat naik bpjs org kerja tdk langsung bantu org butuh tolong sehat situ dlu,0
504,pas dijelasin asuransi sehat lu bodoh jelek in bpjs pas sakit org trsayang sakit lu buru ngurus bpjs pas dah sehat ngga bayar premi sakit buru bayar premi biar dipake lu teriak defisit ken hihhh,0
505,bagus niat bantu saudara tanah air biar manfaat fadilitas sehat sedia bpjs,0
506,berat naikin iur bpjs biaya costs bleeding selesai baik management internal asuransi bidang sehat sy pikir kelola banyak ahli asuransi aktuarist ahli uang,0
507,suksidi silang canada bayang bpjs jalan uang brp orang ri dpt layan sehat spt bpjs sdh kacau balau rs tolak pasien krn rs blm bayar bpjs,0
508,perintah dpt tawar sempat kpd serta privilege brsedia bayar sesuai aktuaria tarik serta asuransi sehat gengsi bpjs rs kelas lg pandang belah mata thdp bpjs kelas,0
509,no worries om tep byr bpjs kes brp premi krn msh jauuuhhh lbh murmer dr asuransi sehat swasta double coverlah anggap,0
510,coba konsul bpjs lanjut asuransi bpjs efek manfaat sehat,0
511,bayar bpjs niat bantu butuh moga keluarga sehat selamat,0
512,cuman sembilan belas rb ribu delapan belas ribu puluh berat nil jamin sehat tdk pake kartu miskin nil ngapain gengsi tdk mending jujur perintah drpd lo paksa sok pake bpjs,0
513,pake bpjs kelas jalur mandiri karyawan aq pake bpjs bpjs bukti mmbantu cover sehat bayar sdh nikmat dr bpjs sdh atus kali lipat bpjs engga drpd batas layan biaya lg,0
514,bener banget alhamdulillah bpjs sehat bayar kerja potong persen gaji,0
515,pola pikir sehat kartu bpjs usaha guna tetap sehat atur sehat jasmani rohani sehat mahal guna kaya kayan obat sakit,0
516,layak iur bpjs naik orang hak konstitusi naik iur kelas satu sedekah bantu biaya sehat obat layan,0
517,dasar hukum naik bpjs beda dasar hukum batal ma laku putus ma batal keren banget rincian naik iur bpjs sehat corona,0
518,ayah beliau axa as sehat alih k as jiwa bikin ribet axa pdahal ayah sakit keras untung keluarga bpjs,0
519,gitu sih lihat data takjub serta bpjs sehat biaya perintah,0
520,tdk sama asuransi swasta bpjs asuransi usaha cari untung bpjs amanat konstitusk layan sehat masyarakat paham,0
521,kritik naik iur bpjs sehat sah sah kritik pakai alas rakyat miskin konyol kuadrat rakyat miskin bayar iur,0
522,rasain struk dlu lo pd bru rasain manfaatny bpjs bpjs anggap ja ni amal sehat pikir sehattt,0
523,klo gtu jgn pusing mikirin bpjs mas untung milik jamin sehat dr gk harap bpjs jgn kritis valid,0
524,bpjs alas negara hadir bantu masyarakat warga rakyat butuh kait didik sehat butuh penuh negara scara gratis indonesia kaya raya mbok kelola,0
525,turun kelas lindung sehat saat krisis ekonomi akibat pandemi serang kenan maaf mohon timbang naik iur bpjs sehat jokowi,0
526,makan mesti muter otak cukup keluarga paham polemik bpjs defisit asuransi sehat perintah asuransi,0
527,gin deh drpd muter mulu elo ngerasain lgsg manfaat bpjs iya knp negara kompleks sehat banget harap iur layan jg baik,0
528,peduli bantu rakyat turun harga bbm turun tarif listrik turun tarif iur bpjs sehat ngadain konser,0
529,tau sehat keluarga uang gimana bantu perintah suruh mandiri bingung inti rengek mahal coba bpjs kls puluh munkin aq usahain,0
530,jokowi cerdas bodoh opsi naik iur bpjs sehat pecat direksi,0
531,krn mantan staf bpjs sehat layan sehat,0
532,indonesia gapunya fasilitas sehat salah iur bpjs dinaikin bikin fasilitas sehat baik salah mau apas,0
533,simpel ferguso prinsip bpjs sehat gotong royong sesuai prinsip dasar sepakat besar iur perintah naik iur bpjs bumn,0
534,bpjs psbb longgar isu herd immunity jalan jg udh bgt jaga sehat gaji puluh jt bulan jg abis obat jaga sehat fisik mental spiritual,0
535,bagus biar bpjs manpu biaya layan keluh sehat masyarakat,0
536,fasilitas baik bpjs sehat perintah masyarakat harap akses pelanyanan sehat baik,0
537,teman sy jatuh dpn rumah tulang retak bayar cash enam puluh juta layang ganti tulang tiru operasi ganti bpjs sehat duit iur bulan ratus ribu ajah,0
538,patah tangan celaka rumah obat rs swasta biaya juta control dokter biaya iya cover full bpjs sehat,0
539,ente udh ajar konsep asuransi ajar gih sblm gonggong bpjs salah bentuk asuransi sehat d kelola perintah klo u pcy bpjs u pake allianz atw prudential bayar tu premi,0
540,rakyatpercayajokowi krn era jokowi fasilitas sehat massal bpjs nikmat rakyat indo,0
541,manajerial bpjs tutup rugi bpjs tutup rakyat bawah nurani dukung upaya perata tingkat layan sehat,0
542,ni tambahin dukung kpk baru naik iur bpjs sehat,0
543,sehat rakyat mari dukung bpjs sehat uang sehat harta no,0
544,pres subsidi juta dukung yuk guys,0
545,guys iur bpjs sembarang direksi bpjs sehat negara hadir bayar iur jkn juta,0
546,informasi pelemgkap mana perpress aman subsidi juta,0
547,patut dukung perintah putus baik pres subsidi juta serta,0
548,miskin sehat gratis bpjs klas naik orang negara dukung perintah peduli orang miskin ngebela bayar klas,0
549,jamin sehat didik salah cita diri bangsa konsep bpjs gotong royong dukung difahami ada sadar wajib benci sakit hati tutup,0
550,dirut bpjs sehat sungguh prestasi bpjs sehat alami defisit dirut bpjs sehat hasil selamat bpjs sehat alami defisit uang,0
551,temu bpkri fair bpk apresiasi bpjs sehat efektif kelola dana bidang sehat masalah rekomendasi potensi beban uang capai miliar bayar kapitasi dasar data serta aktif,0
552,ganjar puji presiden dlm tangan corona tanggap bijak jokowi naik iur bpjs sehat putus populer,0
553,naik bpjs kes kenaikannbpjs kes orang tau sehat mahal lo mesti jaga sehat naik besar naik walahhh berat pasti shok berat deh krisis,0
554,bpjs spt asuransi sehat jaga jgn smp dipake kl jgn dipake,0
555,skema sesuai besar iur bpjs sehat tera mudah paham,0
556,bpjs sehat layan sesuai besar,0
557,iya pa pa iur bpjs sehat krn mmg harga sehat orang konsumtif beli barang online beli nmn harga sehat wabah covid tata ulang prioritas dlm hidup konsumtif tetap bijaksana,0
558,pro logic aja asuransi sehat cover klo premi serendah klo biar aj provider gantiin bpjs klo dinaikin bubar bpjs klo bpjs bubar mudarat lbh dukung baik,0
559,nilai bantu misi negara bantu orang miskin akses layan sehat tarif bpjs murah dunia bantu negara jebol apbn,0
560,kemarin perintah jokowi maruf naik iur bpjs sehat tengah pandemi covid pandang perintah bangga penting rakyat banyak,0
561,jakarta patut gembira rasa nyaman jakarta urus passport bpjs ketenagakerjaan bpjs sehat moga wujud hadir masyarakat badung,0
562,syukur sehat kali bantu krn ada bpjs tolong bayar bpjs bayar bpjs ikhlas smg bantu orang butuh smg kelola bpjs shg manfaat,0
563,gimana udh rumah tetep paksa bayar kaya kantor udh kerjasama asuransi sehat third party tetep wajib bpjs cost sayang nikmat layan,0
564,semangat jaga sehat sehat harga mahal harga serta bpjs tenang,0
565,prinsip bpjs sehat gotong royong elemen libat tutup keluar iur bpjs,0
566,serta bpjs sehat sifat wajib milik jamin sehat bentuk asuransi dobel gitu deh papa tuju bpjs sehat gotong royong tolong iur bpjs,0
567,gotong royong iur bpjs bpjs sehat kelas lintas elemen asn tni polri kerja terima upah swasta ambil bahu bahu,0
568,bpjs pandang sbg solusi jangka sedia layan sehat mandiri sustainable prinsip gotong royong sdh patut ada msh masyarakat beli rokok n pulsa iur bpjs suka ngomel,0
569,subsidi perintah kls mandiri bagi bentuk gotong royong terap bpjs sehat elemen libat tutup keluar iur bpjs,0
570,moga gotong royong jaga kualitas sinambung program jamin sehat masyarakat bpjs jalan iur bpjs,0
571,bahas bpjs sehat moga baik yuk tolong gotong royong serta bpjs iur bpjs,0
572,bpjs sehat utama baik salah prinsip gotong royong iur bpjs,0
573,prinsip anut bpjs sehat gotong royong tolong sambung iur bpjs,0
