,words,cluster
0,masyarakat mudah layan mata fasilitas sehat tingkat,0
1,bpjs sehat ketenagakerjaan manfaat bagus,0
2,alhamdulillah bpjs sehat bener bantu warga pandemi,0
3,bpjs iur banding premi asuransi sehat poin plus,0
4,naik iur org hasil minim bpjs subsidi perintah,0
5,manfaat berkat jkn kis serta bpjs sehat lancar jalan cuci darah,0
6,terimakasih bpjs karna tanggung obat kalau bpjs tau bayar,0
7,jkn kis harisomawati salah serta bpjs sehat lancar jalan cuci darah,0
8,salah fasilitas bpjs sehat jalan cuci darah gratis bukti,0
9,harisomawari salah serta jkn kis lancar jalan cuci darah fasilitas bpjs sehat,0
10,syukur masyarakat bantu banget jkn kis serta bpjs sehat lancar jalan cuci darah,0
11,bpjs sehat bantu warga pandemi,0
12,konsul sehat mental pake bpjs manfaat,0
13,naik iur bpjs biar bpjs hidup bayang bpjs tanggung biaya rumah sakit,0
14,bpjs wajib sehat ketenagakerjaan ketenagakerjaan lumayan banget guna,0
15,alhamdulillah terima kasih lunas tunggak bpjs moga sehat,0
16,alam nunggu ortu hemodialisis bersih darah jadi panik jamin lancar berkat jkn kis,0
17,iur bpjs naik langsung sehat rakyat,0
18,antri pagi bpjs sehat samsat bulak kapal bekas pake masker jaga jarak,0
19,naik iur langsung bpjs sehat yuk,0
20,hadir program jkn kis buka akses layan sehat jangkau kualitas bantu,0
21,wabah corona bpjs layan sepenuh hati baru nih masyarakat aplikasi daring bas media sosial cika suara interaktiv jkn coba,0
22,guna vika chika manfaat salah satu dukung social distance rumah ecek tagih adu coba nih,0
23,inovasi bagus tengah wabah corona dkeluarkan bpjs sehat mana serta aplikasi bas medsos chat jkn chika voice interactive jkn vika,0
24,suka balas cepat cepat balas chat doi,0
25,layan vika chika bpjs sehat ri mudah masyarakat ecek status tagih serta jkn kis pokok support bpjs sehat nih,0
26,ecek status tagih serta jkn kis bpjs sehat care center layan vika berita adu chat asistant jkn chika simple praktis,0
27,bpjs sehat bantu masyarakat layan informasi vika chika,0
28,bangga support bpjs sehat dukung layan vika voice interactive jkn chika chat asistant jkn masyarakat layan,0
29,senang banget bpjs sehat lengkap layan dukung vika mudah akses,0
30,tau nih layan aplikasi mobile jkn aplikasi mudah masyarakat online kantor bpjs sehat,0
31,bpjs sehat layan baik pandemi covid,0
32,bpjs sehat cuci darah mudah,0
33,sadar informasi banget teliti alas iur,0
34,kelas kelas negara hadir bantu masyarakat,0
35,kali dangkal informasi riuh baca biar paham kait bijak bpjs sehat,0
36,gotong royong baik iur bpjs sehat,0
37,naik tarif iur bpjs opsi sulit langsung bpjs sehat jamin sehat masyarakat,0
38,sih bpjs tutup bikin susah rakyat sesuai tarif bpjs bantu masyarakat butuh,0
39,paham yuk dukung apa putus moga layan,0
40,perintah bantu iur serta bpjs sehat moga bpjs sehat layan baik masyarakat,0
41,bpjs sehat mending hapus baik kalau sih bpjs layan sesuai tarif,0
42,perintah usaha bantu masyarakat layan sehat baik moga tenang masyarakat,0
43,ilustrasi kartu ambar serta puas layan bpjs sehat,0
44,ngerti iur kelas aman berat,0
45,jelas iur bpjs kontak mudah paham enak banget,0
46,pasti mending baik hapus kasi butuh,0
47,mending hapus baik sih hapus rasa dampak positif,0
48,atur iur bpjs sehat tetap perintah tuju tingkat fasilitas,0
49,polemik bpjs sehat iur naik protes tepat salah paham rakyat miskin bantu tanggung,0
50,tau gin bpjs mending hapus lanjut kalo mending lanjut benah manfaat,0
51,pribadi pilih bpjs sehat baik prinsip gotong royong tolong dalam,0
52,perintah atur tuju benah depan layan terima masyarakat maksimal,0
53,mending baik masyarakat puas layan bpjs sehat rasa manfaat,0
54,cuman pilih bpjs sehat mending hapus baik sih tuju baik manfaat,0
55,lanjut bpjs penting azas manfaat terima dukung,0
56,pribadi pilih bpjs sehat baik prinsip gotong royong tolong dalam manfaat,0
57,bpjs manfaat,2
58,sumpah baca bpjs kesel tau tenang,0
59,pakai bpjs kan senang gratis,0
60,serta jkn biaya perintah berat,0
61,fasilitas serta turun kelas bpjs sehat panjang program super praktis berat,0
62,iur tapera bpjs sehat naker tuju pajak bea cukai ppn,0
63,aplikasi mobile jkn pandu layan milik bpjs sehat serta bpjs sehat care centre manfaat,0
64,malam teman teman layan bpjs sehat ini layan pandu milik bpjs sehat mudah masyarakat,0
65,bpjs sehat chika vika bantu masyarakat,0
66,fasilitas serta turun kelas bpjs sehat panjang program super praktis manfaat,0
67,awat pasien covid klaim perintah hasil pcr positif hasil pcr hasil negatif pasien tanggung bpjs sehat pasien serta bpjs sehat,0
68,layan tingkat alfian manfaat jkn kis,0
69,mobile jkn mudah komunikasi serta dokter,0
70,layan pandu milik bpjs sehat serta serta puas layan,0
71,info lengkap layan pandu milik bpjs sehat serta manfaat,0
72,susah pandemi bantu layan aplikasi bpjs sehat mobile jkn care center fasilitas chika vika bismillah moga lanjut,0
73,bayar bpjs sehat pdam pln rumah,0
74,hubung bpjs sehat mobile jkn care center chika vika bpjs enak layan,0
75,infografis bpjs sehat mudah paham nih,0
76,layan pandu milik bpjs sehat serta teman cek bantu biar paham,0
77,layan pandu milik bpjs sehat via online offline serta bantu,0
78,kerja gaji potong iur syukur kerja mikirin hak karyawan sehat jamin tua banget kerja swasta mikirin begitu kerja sampe tahun bpjs sehat,0
79,layan aplikasi bpjs sehat manfaat masyarakat mobile jkn care center fasilitas chika vika pokok mudah akses sehat bantu,0
80,bpjs sehat pandu layan serta mudah guna,0
81,guys kasih tau nih layan pandu milik bpjs sehat serta manfaat,0
82,bpjs sehat care center layan serta jkn kis puluh jam bantu,0
83,bpjs sehat milik pandu layan serta loh mudah serta bpjs aksen,0
84,layan bpjs sehat akses serta mudah serta,0
85,gimana nih layananan bpjs sehat maksimal layan sedia serta mantap sih,0
86,pandu layan bpjs sehat harap serta puas cek mana layan serta puas layan bpjs sehat,0
87,mudah bpjs sehat serta layan pandu gambar,0
88,pandu layan milik bpjs sehat mudah layan,0
89,perintah bantu serta jkn kis kelas,0
90,sih bpjs tau latar belakang nge judge iur bawah standar manfaat sungguh resiko butuh naik iuaran bpjs sehat sehat serta,0
91,serta jkn biaya perintah serta segmen terima bantu iur program jamin sehat nasional kelola bpjs sehat,0
92,berita komplit kasih rumah kaga bpjs untung sehat dicover bpjs tapera gimana,0
93,bpjs sehat perhati derita hipertensi diabetes covid,0
94,bpjs layan juang haryanah jalan kemoterapi jkn kis,0
95,chika sahabat serta jkn kis mudah masyarakat,0
96,bpjs sehat pati salur bantu bpjs peduli bantu masyarakat,0
97,iur bpjs naik bpjs ngga bangkrut beban sehat tanggung bpjs capai puluh koma milyar kelas subsidi perintah ngga subsidi dah lu koar koar,0
98,bijak spirit bagus diterapin negara tuju bantu butuh tinggal layak tinggal implementasi sampe jadi kayak bpjs sehat rugi,0
99,prinsip program tapera bpjs sehat bpjs ketenagakerjaan inti serta bayar iur tapera simpan benefitnya serta nikmat manfaat bpjs sehat obat gratis terms and conditions,0
100,iur bpjs tk sehat iur tapera tabung wajib kerja uang kelola softloan sedia huni layak beli bangun rehab kerja nabung situ serta pinjam simpan persen gaji,0
101,lunas tunggak iur tunggak iur tunggak serta data usul serta terima bantu iur iur tanggung perintah sesuai basis data padu,0
102,bpjs naker beres beres sehat masalah beda penting rakyat ngemplang bayar iur pas sakit sembuh stop bayar,0
103,bamsoet panggil akrab dorong perintah pantau biaya awat pasien covid tanggung bpjs sehat,0
104,bpjs sehat bangun sinergi skala global fpgh,0
105,mobil jkn aplikasi andal pandemi covid,0
106,bpjs wajib sehat ketenagakerjaan ketenagakerjaan lumayan banget sih pas pandemi gin phk pas cek saldo tau tau puluh juta tabung sana pas bayar asa sehat blm pake anggap amal,0
107,tahun lawan sakit asam lambung mujiati bantu baik perintah program jkn kis segmen pbi,0
108,iur bpjs naik langsung sehat,0
109,baik jkn kis perintah bantu mujiati lawan sakit,0
110,cerita soko ubah hak kelas jkn kis kendala lindung,0
111,bpjs sehat bener bantu warga pandemi,0
112,konsul sehat mental pake bpjs,0
113,bpjs iur banding premi asuransi sehat hujat habis rakyat indonesia pandai syukur,0
114,naik iur org hasil minim skg bpjs subsidi perintah sisa urus lurah insya allah jalan pribadi syukur bpjs jamin sehat moga manfaat,0
115,simpul pro kontra naik iur bpjs sehat tdk tau skrg jgn pas sakit ngurus eh tau tau ngurus blgnya ribet sulit ayo pikir bantu butuh,0
116,terimakasih bpjs karna tanggung obat tdk bpjs tdk tau bayar obat pakai teman teman tdk sengaja baca twit jaga sehat karna sehat mahal apa,0
117,berterimakasih allah karna sehat hak berterimakasih bpjs karna berkat ortu beban biaya rs,0
118,salah fasilitas bpjs sehat jalan cuci darah gratis sdh bukti,0
119,pandemi bahagia baca kabar pasien bpjs layan cuci darah wabah corona,0
120,serta bpjs sehat bantu sanak kerabat jaga sehat salah satu fasilitas cuci darah sedia terima kasih bpjs,0
121,bayang sih keluarga kena gagal ginjal kudu cuci darah minggu sambung idup sedih kartu jkn kis terima kasih bpjs,0
122,sakit meriang batuk flu manfaat kartu jkn kis asa beda keluarga cuci darah gagal ginjal serta bpjs sehat bantu,0
123,ajak milenial cipta inovasi digital bpjs sehat gelar kompetisi virtual hackathon,0
124,untung pasien serta jkn kis bayar biaya cuci darah,0
125,bgt tolong jkn kis contoh nih,0
126,untuk ikhlas bayar naik bpjs turun kelas doa bayar bpjs sehat untuk mama sehat minum obat umur hidup tanda anak terimakasih bpjs,0
127,tangan rs pasien bpjs sisi ngebantu banget butuh tangan sehat,0
128,bukti bpjs sehat tolong rakyat sakit serta bpjs sehat lancar jalan cuci darah wabah corona,0
129,bpjs sehat mudah serta turun kelas awat,0
130,mba jor joran ngeluarin duit untung bpjs sehat bantu,0
131,bpjs sehat layan sehat baik,0
132,serta bpjs sehat lancar jalan cuci darah jkn kis moga bpjs layan baik masyarakat,0
133,manfaat bpjs sehat rasa banget contoh pasien cuci darah biaya tercover,0
134,salah pasien tolong bgt sma bpjs sehat tu pasien cuci darah op dpt kamar ranap ruang cuci darah banyak pasien so happy tolong,0
135,terimakasih bpjs habis juta rupiah awat lansia jalan ngotot bpjs asuransi sehat doa sehat jatuh sakit biaya obat mahal,0
136,bayang besar biaya tanggung pakai bpjs pasien cuci darah betapa bpjs bantu banget,0
137,bahagia sehat ibu senang bpjs esehatan tenang proses obat,0
138,bpjs sehat bantu masyarakat layan cuci darah wabah covid,0
139,sih jkn kis serta bpjs sehat lancar jalan cuci darah,0
140,anak masuk rumah sakit usia gratis berkat bpjs sehat sedih mikirin nasib pasien cuci darah bpjs hapus,0
141,syukur amat tiada henti ucap bibir ni made sri harisomawati syukur ucap khusus hadir program jamin sehat nasional kis,0
142,malam pandemi virus bpjs sehat ri layan serta jkn kis eperti serta bal terima manfaat bpjs cuci darah kali minggu moga masyarakat puas layan bpjs sehat,0
143,salah serta besyukur jkn kis serta bpjs sehat lancar jalan cuci darah,0
144,puji tuhan bpjs sehat manfaat masyarakat moga masyarakat sehat,0
145,senang dengar wati layan sehat bpjs sehat moga sehat,0
146,artikel pasien jkn kis serta bpjs sehat lancar jalan cuci darah layan bpjs sehat puas masyarakat,0
147,selancar sore sore nemu artikel pasien jkn kis serta bpjs sehat lancar jalan cuci darah layan bpjs sehat puas masyarakat terima kasih bpjs,0
148,jkn kis serta bpjs sehat harisomawati lancar jalan cuci darah minggu kali bantu,0
149,masya allah jkn kis serta bpjs sehat lancar jalan cuci darah bantu moga sehat amin,0
150,pandemi serta bpjs sehat jalan cuci darah lancar,0
151,ayah wanti wanti sampek telat bayar bpjs niat amal sehat tuhan syukur bayar bantu orang sakit,0
152,bpjs ketenagakerjaan mah bagus hitung hitung tabung pensiun celaka kerja ikutin prosedur bantu banget bpjs sehat pakai potong bpjs sehat defisit terima kasih bpjs,0
153,sore dipungkiri tolong bpjs sehat ri,0
154,naik iur harap bpjs layan baik support bpjs sehat layan baik masyarakat indonesia,0
155,iur bpjs harap layan fasilitas baik warga indonesia harap serta puas layan bpjs sehat bantu sakit berat,0
156,iur bpjs relatif murah banding kualitas tangan layan bpjs sehat puasa masyarakat indonesia,0
157,berkat bpjs sehat serta bpjs cuci darah lanjut bpjs baik moga bpjs bantu orang,0
158,alhamdulillah jkn kis serta bpjs sehat lancar jalan cuci darah alami tetangga lancar cuci darah kali minggu,0
159,jkn kis serta bpjs sehat lancar layan cuci darah wabah corona,0
160,moga teman derita gagal ginjal lancar proses cuci darah rumah sakit rasa manfaat bpjs sehat,0
161,barusan liat info guna jkn kis bpjs sehat jalan cuci darah,0
162,obrol mpo dokter pasien cuci darah harap hidup usia puluh bpjs sehat bantu pasien cuci darah tanggung biaya awat,0
163,serta puas layan bpjs sehat harisomawati salah pasien bpjs lancar jalan cuci darah,0
164,harisomawati salah pasien jkn kis rutin jalan cuci darah masa pandemi bagi manfaat serta jkn kis,0
165,wabah corona bpjs sehat layan baik pasien jkn kis jalan cuci darah,0
166,fasilitas layan baik serta jkn kis bpjs sehat cuci darah,0
167,hamdalah berkat jkn kis serta benar rasa manfaat untung bayar iur rutin cuci darah kali minggu mantul,0
168,alam nunggu ortu hemodialisis bersih darah panik jamin lancar berkat jkn kis bpjs sehat,0
169,yuk support bpjs sehat layan baik nyata loh jkn kis serta bpjs sehat lancar jalan cuci darah prinsip gotong royong tolong nih,0
170,bukti jkn kis bantu masyarakat salah satu harisomawati cuci darah jkn kis gotong royong tolong,0
171,harisomawati salah serta jkn kis rasa manfaat program jkn kis pandemi lancar jalan cuci darah,0
172,pasien serta bpjs sehat jalan cuci darah alhamdulillah lancar jkn kis bantu jalan obat pikir biaya,0
173,rasa manfaat bpjs sehat nih serta jkn kis lancar jalan cuci darah beliau syukur bpjs sehat hadir masyarakat,0
174,alhamdulillah serta bpjs sehat lancar cuci darah jkn kis moga cepat sembuh,0
175,simak deh info jkn kis serta bpjs sehat lancar jalan cuci darah alhamdulillah moga guna bantu,0
176,alhamdulillah jkn kis lancar jalan cuci darah manfaat serta jkn kis bpjs sehat,0
177,jkn kis serta bpjs sehat lancar jalan cuci darah mudah keluar layan bpjs sehat,0
178,jkn kis serta bpjs sehat lancar jalan cuci darah,2
179,berkat bpjs sehat cuci darah lancar jalan gotong royong tolong,0
180,tengah kondisi pasien cuci darah binggung cuci darah uan untung jkn kis bantu serta cuci darah halang,0
181,ipar perempuan lahir bantu bpjs sehat lahir gimana cuci darah periode bantu,0
182,jkn kis serta bpjs sehat lancar jalan cuci darah neng dengernya moga lekas sembuh mbak,0
183,jalan cuci darah rutin biaya butuh untung bpjs mengcover biaya cuci darah pasien bantu,0
184,bpjs sehat tolong rakyat sakit info bawah serta bpjs sehat lancar jalan cuci darah,0
185,tengah kondisi pasien bpjs sehat lancar loh jalan cuci darah hambat apa terima kasih bpjs sehat ri,0
186,bpjs sehat tolong rakyat sakit nyata baca berita bawah pasien layan cuci darah wabah corona tanggung biaya awat,0
187,delapan jalan obat rutin cuci darah rsud saiful anwar khawatir kait biaya obat dicover bpjs sehat syukur,0
188,wabah bpjs sehat tolong rakyat sakit salah saksi serta lancar jalan cuci darah,0
189,suka main sakit mama tugas curhatan pasien nih cerita berkat jkn kis bpjs sehat rutin cuci darah,0
190,bpjs sehat tolong bantu bangun masyarakat,0
191,manfaat jkn kis contoh serta bpjs sehat lancar jalan cuci darah pikir biaya mahal,0
192,serta bpjs sehat lancar cuci darah manfaat jkn kis,0
193,wujud nyata kerja bpjs serta jkn kis jalan cuci darah lancar bpjs sehat dukung gotong royong tolong,0
194,jkn kis serta bpjs sehat lancar jalan program cuci darah beliau syukur jkn kis,0
195,iya tri harga bpjs rs swasta mahal terima kasih perintah jokowi sehat selamat rakyat bangsa,0
196,asli deh bosen bgt ngadepin org konsultasi sakit butuh periksa bingung gara bpjs serius asuransi sehat karna akses layan sehat butuh primer inget jgn ngegampangin ngasih tau nyesel,0
197,biaya sehat bilang jangkau bpjs bilang murah manfaat banget,0
198,pantes series new amsterdam diceritain gimana jelek sistem sehat indonesia suka bete bpjs turut engga mahal,0
199,manfaat terima serta jamin sehat nasional jkn,0
200,naik iur bpjs sehat wajar jangkau,0
201,iur bpjs benah sehat naik bpjs pelayananya beda bantu sakit berat,0
202,iur bpjs sehat naik defisit uang nilai bayang asuransi sehat milik perintah bantu masyarakat butuh,0
203,jangkau naik tarif bpjs upgrade sehat iur bpjs sesuai prosedur sehat,0
204,baik sistem upgrade sehat naik baru tatanan bpjs bantu serta jkn kis,0
205,perintah bantu subsidi iur bpjs sehat,0
206,bayar operasi biaya operasi dokter juta bayar bebas biaya terima kasih bpjs,0
207,cuci darah delapan gatot terima kasih serta jkn kis,0
208,modal kartu jkn kis salin bebas biaya bantu banget,0
209,bpjs bantu hitung iur bayar tdk banding jik awat biaya rumah sakit mahal syukur pemerinrah perhati sehat,0
210,teman pasang pen tulang rs fatmawati bpjs sehat gratis bolak manfaat,0
211,menghayal perintah pelayana sehat gratis bpjs puas lebih kurang,0
212,perhati bpjs jamin sehat rakyat alami defisit wajar perintah selamat menyalamatkan penting rakyat jernih pikir tendesius,0
213,sadar perintah usaha jamin sehat sepenuh rasa manfaat biar defisit ambyar buat skema subsidi kelas,0
214,naik iur bpjs sehat hindar defisit anggar naik prediksi tingkat fasilitas sehat serta paham luap postingan provokatif,0
215,puji syukur bpjs sehat ayah rawat rs jantung harkit puluh tanggung bpjs sehat program dr mid thn ribu belas daftar kerja,0
216,sepakat pikir serta bpjs kelas alhamdulillah kasih sehat biar butuh manfaat senang gotong royong bantu butuh,0
217,buat asuransi sehat bpjs murah manfaat,0
218,mending iur bpjs sehat bubar era mana orang miskin larang sakit,0
219,saat negara hadir layan sehat sambut peran aktif rakyat coba bpjs hapus krn problem defisit turun turun gimana nasib sakit berat,0
220,bpjs bpjs sehat alami defisit naik iur salah kurang defisit manfaat,0
221,bpjs ratus ribu teriak sehat butuh primer manusia beli paket internet bayar wifi notabene cuman butuh sekunder miris teknologi kalah akal sehat,0
222,bpjs program gotong royong serta maaf gratis alias bayar perintah kis serta bayar anggap kelas tinggal pilih sesuai mampu sehat mahal,0
223,bpjs manfaat murah asuransi sehat swasta telat sampe bayar iur,0
224,rakyat sanggup bayar iur bpjs sehat kelas iur naik,0
225,gotong royong harap jaga kualitas sinambung program jamin sehat masyarakat bpjs jalan lanjut,0
226,langsung bpjs salah ladang amal bantu lemah ekonomi,0
227,pokok paham prinsip iur bpjs susah doyan boba coba anggar boba bayar bpjs sehat sisa yuk gotong royong tolong tolong rajin bayar iur,0
228,kontribusi perintah subsidi iur bpjs sehat rasa bantu serta bpjs serta jkn kis,0
229,perintah cari solusi biaya sehat jamin bpjs sehat tolong tolong iur bpjs gimana sakit kelas nutupi kurang biaya sehat bpjs sehat gratis,0
230,sehat no uang sakit sakit rasa mahal sehat tuju naik bpjs sehat,0
231,support insya allah jalan lancar layan bpjs sehat ganggu,0
232,teman teman alami sulit ekonomi plis telat bayar iur bpjs sehat support mndukung lancar bpjs sehat,0
233,harap naik iur bpjs moga depan layan bpjs sehat tingkat layan masyarakat maksimal,0
234,alhamdulillah bpjs sehat asuransi layan baik keluarga,0
235,bpjs sehat bantu masyarakat tengah rutin obat bpjs biaya keluar cover biaya,0
236,bijak ambil langsung bpjs sehat maklum sesuai besar tarif iur bpjs,0
237,sehat jamin perintah warga miskin itu prosedur prosedur rt rw lurah camat bpjs kartu bpjs langsung obat,0
238,bijak terap cegah masyarakat sembarang pindah pindah kelas bulan sulit bpjs sehat biaya sehat,0
239,naik iur langsung bpjs sehat,1
240,mari support bpjs sehat bpjs sehat rasa manfaat,0
241,elemen libat tutup keluar alas naik iur bpjs iur kumpul cukup biaya program bpjs sehat sesuai besar tarif,0
242,bpjs butuh gotong royong tahan eksistensi layan sehat masyarakat naik iur serta kelas efektif ribu puluh subsidi sembilan ribu ratus iur berat pindah kelas,0
243,naik kelas notabene orang donasi covid gotong royong bpjs sehat turun kls kelas tanggung bpjs,0
244,ceceu rasa manfaat bpjs sehat teman kerja ceceu jg istri lahir bantu rawat inap bantu biaya cover bpjs sehat,0
245,bantu manfaat sehat bpjs iur bpjs asuransi sisih antisipasi risiko,0
246,critanya bpjs sehat defisit ribu belas parah ribu tujuh belas ribu delapan belas salah satu tunggak bayar iur bpjs bantu gotong royong bantu butuh,0
247,serta bantu bpjs sehat biaya rumah sakit mahal,0
248,naik sesuai pres enam puluh subsidi koma triliun carry on defisit indonesia jamin sehat sepenuh pola skrg masyarakat manfaat hancur bpjs awas,0
249,dipikirin gimana usaha asuransi compete kasi harga murah kerjasama program subsidi sehat bpjs miskin dicover full sisi edukasi push strong middle class bantu,0
250,bpjs bantu masyarakat azas gotong royong panik salah satu jaga sehat,0
251,sadar prinsip bpjs sehat gotong royong tolong salah bentuk sumbangsih negeri tolong butuh bantu dana awat sehat syukur pakai sakit,0
252,perintah peduli krisis naik iur bpjs perintah peduli krn layan maksimal sehat masyarakat subisidi kelas,0
253,moga sesuai iur bpjs tingkat kualitas layan bpjs sehat jaga langsung bpjs sehat,0
254,sih hilang kerja iur bpjs sehat naik perintah paham kelas naik subsidi,0
255,sesuai iur bpjs langsung bpjs sehat layan lapis masyarakat,0
256,polemik bpjs sehat isu naik iur semena mena hoax fakta sesuai kelas ubah,0
257,semenjak serta bpjs sehat bantu terima kasih bpjs sehat,0
258,mumpung thr lupa bayar zakat bayar tunggak iur bpjs langsung layan bpjs sehat optimal,0
259,putus ambil berat langsung bpjs sehat tingkat cukup dana layan,0
260,bpjs jaga kualitas sinambung program jamin sehat,0
261,didebatin bantu perintah kasi urus sehat rakyat moga pemerintahanan turunin bpjs,0
262,naik iur bpjs timbang matang lanjut layan bpjs sehat,0
263,kelas mampu ekonomi beda kelas mampu ekonomi harap langsung bpjs sehat,0
264,sanggup bayar bpjs bpjs pola hidup sehat doa moga senantiasa sehat biar uang obat keluh trs medsos sanggup renti gitu repot,0
265,bpjs sehat jamin bayar iur nunggak jaga sehat,0
266,perintah jg bijak covid tunggak iur bpjs bayar maksimal enam tunggak jg serta bpjs sehat jkn kis tunggak longgar lunas status serta aktif,0
267,prinsip bpjs sehat gotong royong tolong naik iur tolong tingkat faslititas bpjs sehat,0
268,heboh marah provokasi tugas bpjs sehat biar salah paham serta jkn kis tunggak longgar lunas status serta aktif,0
269,iur bpjs sehat kelas kelas kelas gratis gratis teriak iur bpjs sengsara orang miskin org bagi org miskin lindung balik org miskin,0
270,sulit perintah jg pikir bpjs sehat covid tunggak iur bpjs bayar maksimal enam tunggak khawatir makan hoaks,0
271,bpjs sehat sakit bayar biaya rumah sakit mahal rajin bayar iur bpjs,0
272,prinsip anut bpjs sehat gotong royong tolong sambung,0
273,tutup bahas bpjs sehat moga baik yuk tolong gotong royong serta bpjs,0
274,serta bpjs sehat dukung bijak bpjs sehat layan masyarakat,0
275,bpjs sehat utama baik salah prinsip gotong royong,0
276,bahas bpjs sehat moga baik yuk tolong gotong royong,0
277,iur bpjs sikap bijak alhamdulillah subsidi pasti support bpjs sehat layan baik,0
278,iur bayar heboh ubah angka jg heboh baca tabel iur bpjs jd paham bpjs sehat,0
279,dukung bpjs sehat layan baik serta,0
280,putus berat ambil krisis perintah solusi langsung bpjs sehat dukung,0
281,kontribusi jaga serta bpjs sehat aktif rajin bayar iur bpjs rutin,0
282,moga gotong royong jaga kualitas sinambung program jamin sehat masyarakat program bpjs jalan,0
283,dasar bpjs sehat layan sehat serta jkn kis hambat pandemi,0
284,sih kaget turut sih gpp biaa tingkat fasilitas bpjs sehat,0
285,tdk batas asuransi sehat batas limit bpjs tercover,0
286,subsidi perintah kls mandiri bagi bentuk gotong royong terap bpjs sehat elemen libat tutup keluar,0
287,support bpjs sehat layan puas masyarakat gotong royong tolong,0
288,prinsip gotong royong tolong lapis masyarakat layan sehat bpjs,0
289,iur bpjs negara hadir sesuai iur bpjs sehat sesuai pres no enam ribu puluh,0
290,bpjs pandang sbg solusi jangka sedia layan sehat mandiri sustainable prinsip gotong royong patut ada masyarakat beli rokok pulsa iur bpjs suka ngomel,0
291,naik iur bpjs jaga operasional jamin sehat iur naik perintah pusat perintah subsidi bayar bpjs sehat,0
292,pandemi covid orang kena dampak perintah bpjs sehat diam cari jalan baik masyarakat,0
293,naik iur bpjs sehat timbang hitung ability to pay mampu bayar masyarakat,0
294,mumpung lebaran pekan tuntas bayar iur bpjs langsung layan bpjs sehat optimal,0
295,putus ambil berat lanjut bpjs sehat,0
296,bpjs sehat masyarakat nyaman obat jaga sehat,0
297,serta bpjs sehat sifat wajib milik jamin sehat bentuk asuransi dobel gitu deh gapapa tuju bpjs sehat gotong royong tolong,0
298,bayar iur ratus puluh ribu bulan sakit rawat hari rumah sakit bayar ratus ribu hari kunjung dokter tindak operasi butuh coba hitung asuransi murah bpjs cek sehat daftar,0
299,elemen libat tutup keluar bpjs sehat masyarakat rasa manfaat,0
300,rawat inap tujuh enam malam gara gara sakit lambung vertigo akut rawat jalan obat obat gratis bpjs sehat kelas bayar iur kali rasa manfaat,0
301,bijak naik iur langsung bpjs sehat,0
302,jamin sehat banget emang bom sakit sih ngga asa manfaat sakit asa banget loh sakit suruh bayar sekian puluh juta sakit banget bpjs,0
303,bpjs sehat masyarakat nikmat lindung jamin sehat biaya jangkau prinsip bpjs gotong royong tolong,0
304,tahu guys bpjs benar naik iur jalan maksimal layan sehat aman tau bpjs defisit parah,0
305,tunggak iur kartu bpjs langsung aktif pandemi bpjs sehat longgar,0
306,hapus bpjs sehat bantu keluarga rasa manfaat bpjs sehat obat mertua kena stroke gratis rawat jalan fisiotherapy rawat inap operasi obat obat cek darah gratis bayar iur kelas,0
307,bilang bpjs sehat php perintah php perintah pikir rakyat perintah peduli,0
308,perintah hadir sesuai iur bpjs sehat pres no enam ribu puluh,0
